magia negra,magia negra,"[True, True]","Candomblé pensam logo em magia negra , ou macumba .","[False, False, False, False, True, True, False, False, False, False]","Candomblé pensam logo em magia negra , ou macumba .","[True, True, True, True, True, True, True, True, True, True]","Candomblé pensam logo em magia , ou macumba .","[False, False, False, False, True, False, False, False, False]","Candomblé pensam logo em negra , ou macumba .","[False, False, False, False, True, False, False, False, False]","Candomblé pensam logo em magia normal , ou macumba .","[False, False, False, False, True, True, False, False, False, False]","Candomblé pensam logo em coisa negra , ou macumba .","[False, False, False, False, True, True, False, False, False, False]","Candomblé pensam logo em magia preta , ou macumba .","[False, False, False, False, True, True, False, False, False, False]","Candomblé pensam logo em feitiçaria negra , ou macumba .","[False, False, False, False, True, True, False, False, False, False]","Candomblé pensam logo em feitiçaria preta , ou macumba .","[False, False, False, False, True, True, False, False, False, False]","Candomblé pensam logo em bruxaria , ou macumba .","[False, False, False, False, True, False, False, False, False]","Candomblé pensam logo em pior motivo , ou macumba .","[False, False, False, False, True, True, False, False, False, False]","Candomblé pensam logo em alta-costura , ou macumba .","[False, False, False, False, True, False, False, False, False]","Candomblé pensam logo em união formal , ou macumba .","[False, False, False, False, True, True, False, False, False, False]","Candomblé pensam logo em maré alta , ou macumba .","[False, False, False, False, True, True, False, False, False, False]","Candomblé pensam logo em queixa legal , ou macumba .","[False, False, False, False, True, True, False, False, False, False]","Candomblé pensam logo em quinta categoria , ou macumba .","[False, False, False, False, True, True, False, False, False, False]","Candomblé pensam logo em tradições específicas , ou macumba .","[False, False, False, False, True, True, False, False, False, False]","Candomblé pensam logo em montanha-russa , ou macumba .","[False, False, False, False, True, False, False, False, False]","Candomblé pensam logo em homens válidos , ou macumba .","[False, False, False, False, True, True, False, False, False, False]","Candomblé pensam logo em tartaruga-marinha , ou macumba .","[False, False, False, False, True, False, False, False, False]"
mão-fechada,mão-fechada,[True],"A questão não é ser mão-fechada , mas acho que compensa mais você comprar um livro por um preço bacana e gastar o resto da grana com outra coisa .","[False, False, False, False, False, True, False, False, False, False, False, False, False, False, False, False, False, False, False, False, False, False, False, False, False, False, False, False, False, False]","A questão não é ser mão-fechada , mas acho que compensa mais você comprar um livro por um preço bacana e gastar o resto da grana com outra coisa .","[True, True, True, True, True, True, True, True, True, True, True, True, True, True, True, True, True, True, True, True, True, True, True, True, True, True, True, True, True, True]","A questão não é ser mão , mas acho que compensa mais você comprar um livro por um preço bacana e gastar o resto da grana com outra coisa .","[False, False, False, False, False, True, False, False, False, False, False, False, False, False, False, False, False, False, False, False, False, False, False, False, False, False, False, False, False, False]","A questão não é ser fechada , mas acho que compensa mais você comprar um livro por um preço bacana e gastar o resto da grana com outra coisa .","[False, False, False, False, False, True, False, False, False, False, False, False, False, False, False, False, False, False, False, False, False, False, False, False, False, False, False, False, False, False]","A questão não é ser mão normal , mas acho que compensa mais você comprar um livro por um preço bacana e gastar o resto da grana com outra coisa .","[False, False, False, False, False, True, True, False, False, False, False, False, False, False, False, False, False, False, False, False, False, False, False, False, False, False, False, False, False, False, False]","A questão não é ser coisa fechada , mas acho que compensa mais você comprar um livro por um preço bacana e gastar o resto da grana com outra coisa .","[False, False, False, False, False, True, True, False, False, False, False, False, False, False, False, False, False, False, False, False, False, False, False, False, False, False, False, False, False, False, False]","A questão não é ser mão cerrada , mas acho que compensa mais você comprar um livro por um preço bacana e gastar o resto da grana com outra coisa .","[False, False, False, False, False, True, True, False, False, False, False, False, False, False, False, False, False, False, False, False, False, False, False, False, False, False, False, False, False, False, False]","A questão não é ser palmo fechado , mas acho que compensa mais você comprar um livro por um preço bacana e gastar o resto da grana com outra coisa .","[False, False, False, False, False, True, True, False, False, False, False, False, False, False, False, False, False, False, False, False, False, False, False, False, False, False, False, False, False, False, False]","A questão não é ser palmo cerrado , mas acho que compensa mais você comprar um livro por um preço bacana e gastar o resto da grana com outra coisa .","[False, False, False, False, False, True, True, False, False, False, False, False, False, False, False, False, False, False, False, False, False, False, False, False, False, False, False, False, False, False, False]","A questão não é ser pão duro , mas acho que compensa mais você comprar um livro por um preço bacana e gastar o resto da grana com outra coisa .","[False, False, False, False, False, True, True, False, False, False, False, False, False, False, False, False, False, False, False, False, False, False, False, False, False, False, False, False, False, False, False]","A questão não é ser herói positivo , mas acho que compensa mais você comprar um livro por um preço bacana e gastar o resto da grana com outra coisa .","[False, False, False, False, False, True, True, False, False, False, False, False, False, False, False, False, False, False, False, False, False, False, False, False, False, False, False, False, False, False, False]","A questão não é ser algodão-doce , mas acho que compensa mais você comprar um livro por um preço bacana e gastar o resto da grana com outra coisa .","[False, False, False, False, False, True, False, False, False, False, False, False, False, False, False, False, False, False, False, False, False, False, False, False, False, False, False, False, False, False]","A questão não é ser eventual infecção , mas acho que compensa mais você comprar um livro por um preço bacana e gastar o resto da grana com outra coisa .","[False, False, False, False, False, True, True, False, False, False, False, False, False, False, False, False, False, False, False, False, False, False, False, False, False, False, False, False, False, False, False]","A questão não é ser pé-direito , mas acho que compensa mais você comprar um livro por um preço bacana e gastar o resto da grana com outra coisa .","[False, False, False, False, False, True, False, False, False, False, False, False, False, False, False, False, False, False, False, False, False, False, False, False, False, False, False, False, False, False]","A questão não é ser níveis apreciáveis , mas acho que compensa mais você comprar um livro por um preço bacana e gastar o resto da grana com outra coisa .","[False, False, False, False, False, True, True, False, False, False, False, False, False, False, False, False, False, False, False, False, False, False, False, False, False, False, False, False, False, False, False]","A questão não é ser lugar-comum , mas acho que compensa mais você comprar um livro por um preço bacana e gastar o resto da grana com outra coisa .","[False, False, False, False, False, True, False, False, False, False, False, False, False, False, False, False, False, False, False, False, False, False, False, False, False, False, False, False, False, False]","A questão não é ser inúmeras perdas , mas acho que compensa mais você comprar um livro por um preço bacana e gastar o resto da grana com outra coisa .","[False, False, False, False, False, True, True, False, False, False, False, False, False, False, False, False, False, False, False, False, False, False, False, False, False, False, False, False, False, False, False]","A questão não é ser alto mar , mas acho que compensa mais você comprar um livro por um preço bacana e gastar o resto da grana com outra coisa .","[False, False, False, False, False, True, True, False, False, False, False, False, False, False, False, False, False, False, False, False, False, False, False, False, False, False, False, False, False, False, False]","A questão não é ser textura sonora , mas acho que compensa mais você comprar um livro por um preço bacana e gastar o resto da grana com outra coisa .","[False, False, False, False, False, True, True, False, False, False, False, False, False, False, False, False, False, False, False, False, False, False, False, False, False, False, False, False, False, False, False]","A questão não é ser pólo-aquático , mas acho que compensa mais você comprar um livro por um preço bacana e gastar o resto da grana com outra coisa .","[False, False, False, False, False, True, False, False, False, False, False, False, False, False, False, False, False, False, False, False, False, False, False, False, False, False, False, False, False, False]"
máquina virtual,máquina virtual,"[True, True]",Os bytecodes são interpretados pela máquina virtual Java .,"[False, False, False, False, False, True, True, False, False]",Os bytecodes são interpretados pela máquina virtual Java .,"[True, True, True, True, True, True, True, True, True]",Os bytecodes são interpretados pela máquina Java .,"[False, False, False, False, False, True, False, False]",Os bytecodes são interpretados pela virtual Java .,"[False, False, False, False, False, True, False, False]",Os bytecodes são interpretados pela máquina normal Java .,"[False, False, False, False, False, True, True, False, False]",Os bytecodes são interpretados pela coisa virtual Java .,"[False, False, False, False, False, True, True, False, False]",Os bytecodes são interpretados pela máquina potencial Java .,"[False, False, False, False, False, True, True, False, False]",Os bytecodes são interpretados pelo aparelho virtual Java .,"[False, False, False, False, False, True, True, False, False]",Os bytecodes são interpretados pelo aparelho potencial Java .,"[False, False, False, False, False, True, True, False, False]",Os bytecodes são interpretados pelo computador virtual Java .,"[False, False, False, False, False, True, True, False, False]",Os bytecodes são interpretados pelo escritor vencedor Java .,"[False, False, False, False, False, True, True, False, False]",Os bytecodes são interpretados pela saia justa Java .,"[False, False, False, False, False, True, True, False, False]",Os bytecodes são interpretados pela electrónica moderna Java .,"[False, False, False, False, False, True, True, False, False]",Os bytecodes são interpretados pela gripe aviária Java .,"[False, False, False, False, False, True, True, False, False]",Os bytecodes são interpretados pela estratégia genérica Java .,"[False, False, False, False, False, True, True, False, False]",Os bytecodes são interpretados pela quinta categoria Java .,"[False, False, False, False, False, True, True, False, False]",Os bytecodes são interpretados pela dívida multilateral Java .,"[False, False, False, False, False, True, True, False, False]",Os bytecodes são interpretados pela secretária eletrônica Java .,"[False, False, False, False, False, True, True, False, False]",Os bytecodes são interpretados pelas entidades feministas Java .,"[False, False, False, False, False, True, True, False, False]",Os bytecodes são interpretados pela febre amarela Java .,"[False, False, False, False, False, True, True, False, False]"
mar aberto,mar aberto,"[True, True]",Ele condena a turma a nadar em mar aberto .,"[False, False, False, False, False, False, False, True, True, False]",Ele condena a turma a nadar em mar aberto .,"[True, True, True, True, True, True, True, True, True, True]",Ele condena a turma a nadar em mar .,"[False, False, False, False, False, False, False, True, False]",Ele condena a turma a nadar em aberto .,"[False, False, False, False, False, False, False, True, False]",Ele condena a turma a nadar em mar normal .,"[False, False, False, False, False, False, False, True, True, False]",Ele condena a turma a nadar em coiso aberto .,"[False, False, False, False, False, False, False, True, True, False]",Ele condena a turma a nadar em mar acessível .,"[False, False, False, False, False, False, False, True, True, False]",Ele condena a turma a nadar em oceano aberto .,"[False, False, False, False, False, False, False, True, True, False]",Ele condena a turma a nadar em oceano acessível .,"[False, False, False, False, False, False, False, True, True, False]",Ele condena a turma a nadar em alto mar .,"[False, False, False, False, False, False, False, True, True, False]",Ele condena a turma a nadar em tremenda quantidade .,"[False, False, False, False, False, False, False, True, True, False]",Ele condena a turma a nadar em alarme falso .,"[False, False, False, False, False, False, False, True, True, False]",Ele condena a turma a nadar em domínio chinês .,"[False, False, False, False, False, False, False, True, True, False]",Ele condena a turma a nadar em lugar-comum .,"[False, False, False, False, False, False, False, True, False]",Ele condena a turma a nadar em actualidade regional .,"[False, False, False, False, False, False, False, True, True, False]",Ele condena a turma a nadar em elefante branco .,"[False, False, False, False, False, False, False, True, True, False]",Ele condena a turma a nadar em discos antigos .,"[False, False, False, False, False, False, False, True, True, False]",Ele condena a turma a nadar em regime político .,"[False, False, False, False, False, False, False, True, True, False]",Ele condena a turma a nadar em mercados exteriores .,"[False, False, False, False, False, False, False, True, True, False]",Ele condena a turma a nadar em deputado federal .,"[False, False, False, False, False, False, False, True, True, False]"
maré alta,maré alta,"[True, True]",Seu volume também o condiciona a uma oscilação muito maior de suas águas quando dos intervalos entre maré alta a maré baixa .,"[False, False, False, False, False, False, False, False, False, False, False, False, False, False, False, False, False, True, True, False, False, False, False]",Seu volume também o condiciona a uma oscilação muito maior de suas águas quando dos intervalos entre maré alta a maré baixa .,"[True, True, True, True, True, True, True, True, True, True, True, True, True, True, True, True, True, True, True, True, True, True, True]",Seu volume também o condiciona a uma oscilação muito maior de suas águas quando dos intervalos entre maré a maré baixa .,"[False, False, False, False, False, False, False, False, False, False, False, False, False, False, False, False, False, True, False, False, False, False]",Seu volume também o condiciona a uma oscilação muito maior de suas águas quando dos intervalos entre alta a maré baixa .,"[False, False, False, False, False, False, False, False, False, False, False, False, False, False, False, False, False, True, False, False, False, False]",Seu volume também o condiciona a uma oscilação muito maior de suas águas quando dos intervalos entre maré normal a maré baixa .,"[False, False, False, False, False, False, False, False, False, False, False, False, False, False, False, False, False, True, True, False, False, False, False]",Seu volume também o condiciona a uma oscilação muito maior de suas águas quando dos intervalos entre coisa alta a maré baixa .,"[False, False, False, False, False, False, False, False, False, False, False, False, False, False, False, False, False, True, True, False, False, False, False]",Seu volume também o condiciona a uma oscilação muito maior de suas águas quando dos intervalos entre maré elevada a maré baixa .,"[False, False, False, False, False, False, False, False, False, False, False, False, False, False, False, False, False, True, True, False, False, False, False]",Seu volume também o condiciona a uma oscilação muito maior de suas águas quando dos intervalos entre fluxo alto a maré baixa .,"[False, False, False, False, False, False, False, False, False, False, False, False, False, False, False, False, False, True, True, False, False, False, False]",Seu volume também o condiciona a uma oscilação muito maior de suas águas quando dos intervalos entre fluxo elevado a maré baixa .,"[False, False, False, False, False, False, False, False, False, False, False, False, False, False, False, False, False, True, True, False, False, False, False]",Seu volume também o condiciona a uma oscilação muito maior de suas águas quando dos intervalos entre mar alto a maré baixa .,"[False, False, False, False, False, False, False, False, False, False, False, False, False, False, False, False, False, True, True, False, False, False, False]",Seu volume também o condiciona a uma oscilação muito maior de suas águas quando dos intervalos entre próspera sociedade a maré baixa .,"[False, False, False, False, False, False, False, False, False, False, False, False, False, False, False, False, False, True, True, False, False, False, False]",Seu volume também o condiciona a uma oscilação muito maior de suas águas quando dos intervalos entre roleta russa a maré baixa .,"[False, False, False, False, False, False, False, False, False, False, False, False, False, False, False, False, False, True, True, False, False, False, False]",Seu volume também o condiciona a uma oscilação muito maior de suas águas quando dos intervalos entre jornais importantes a maré baixa .,"[False, False, False, False, False, False, False, False, False, False, False, False, False, False, False, False, False, True, True, False, False, False, False]",Seu volume também o condiciona a uma oscilação muito maior de suas águas quando dos intervalos entre terceira pessoa a maré baixa .,"[False, False, False, False, False, False, False, False, False, False, False, False, False, False, False, False, False, True, True, False, False, False, False]",Seu volume também o condiciona a uma oscilação muito maior de suas águas quando dos intervalos entre imprensa espanhola a maré baixa .,"[False, False, False, False, False, False, False, False, False, False, False, False, False, False, False, False, False, True, True, False, False, False, False]",Seu volume também o condiciona a uma oscilação muito maior de suas águas quando dos intervalos entre força bruta a maré baixa .,"[False, False, False, False, False, False, False, False, False, False, False, False, False, False, False, False, False, True, True, False, False, False, False]",Seu volume também o condiciona a uma oscilação muito maior de suas águas quando dos intervalos entre área florestal a maré baixa .,"[False, False, False, False, False, False, False, False, False, False, False, False, False, False, False, False, False, True, True, False, False, False, False]",Seu volume também o condiciona a uma oscilação muito maior de suas águas quando dos intervalos entre massa cinzenta a maré baixa .,"[False, False, False, False, False, False, False, False, False, False, False, False, False, False, False, False, False, True, True, False, False, False, False]",Seu volume também o condiciona a uma oscilação muito maior de suas águas quando dos intervalos entre única região a maré baixa .,"[False, False, False, False, False, False, False, False, False, False, False, False, False, False, False, False, False, True, True, False, False, False, False]",Seu volume também o condiciona a uma oscilação muito maior de suas águas quando dos intervalos entre maré baixa a maré baixa .,"[False, False, False, False, False, False, False, False, False, False, False, False, False, False, False, False, False, True, True, False, False, False, False]"
maré baixa,maré baixa,"[True, True]",Apresenta grandes raízes aéreas que ficam expostas durante a maré baixa .,"[False, False, False, False, False, False, False, False, False, True, True, False]",Apresenta grandes raízes aéreas que ficam expostas durante a maré baixa .,"[True, True, True, True, True, True, True, True, True, True, True, True]",Apresenta grandes raízes aéreas que ficam expostas durante a maré .,"[False, False, False, False, False, False, False, False, False, True, False]",Apresenta grandes raízes aéreas que ficam expostas durante a baixa .,"[False, False, False, False, False, False, False, False, False, True, False]",Apresenta grandes raízes aéreas que ficam expostas durante a maré normal .,"[False, False, False, False, False, False, False, False, False, True, True, False]",Apresenta grandes raízes aéreas que ficam expostas durante a coisa baixa .,"[False, False, False, False, False, False, False, False, False, True, True, False]",Apresenta grandes raízes aéreas que ficam expostas durante a maré inferior .,"[False, False, False, False, False, False, False, False, False, True, True, False]",Apresenta grandes raízes aéreas que ficam expostas durante o fluxo baixo .,"[False, False, False, False, False, False, False, False, False, True, True, False]",Apresenta grandes raízes aéreas que ficam expostas durante o fluxo inferior .,"[False, False, False, False, False, False, False, False, False, True, True, False]",Apresenta grandes raízes aéreas que ficam expostas durante a baixa mar .,"[False, False, False, False, False, False, False, False, False, True, True, False]",Apresenta grandes raízes aéreas que ficam expostas durante o verso inteiro .,"[False, False, False, False, False, False, False, False, False, True, True, False]",Apresenta grandes raízes aéreas que ficam expostas durante a carne vermelha .,"[False, False, False, False, False, False, False, False, False, True, True, False]",Apresenta grandes raízes aéreas que ficam expostas durante a taekwondista estadunidense .,"[False, False, False, False, False, False, False, False, False, True, True, False]",Apresenta grandes raízes aéreas que ficam expostas durante a primeira mão .,"[False, False, False, False, False, False, False, False, False, True, True, False]",Apresenta grandes raízes aéreas que ficam expostas durante o físico teórico .,"[False, False, False, False, False, False, False, False, False, True, True, False]",Apresenta grandes raízes aéreas que ficam expostas durante a vista grossa .,"[False, False, False, False, False, False, False, False, False, True, True, False]",Apresenta grandes raízes aéreas que ficam expostas durante a pressão vendedora .,"[False, False, False, False, False, False, False, False, False, True, True, False]",Apresenta grandes raízes aéreas que ficam expostas durante a ficha limpa .,"[False, False, False, False, False, False, False, False, False, True, True, False]",Apresenta grandes raízes aéreas que ficam expostas durante os bens finais .,"[False, False, False, False, False, False, False, False, False, True, True, False]",Apresenta grandes raízes aéreas que ficam expostas durante a gripe suína .,"[False, False, False, False, False, False, False, False, False, True, True, False]"
