primeira-dama,primeira-dama,[True],Jorginho conta que Luviana é uma primeira-dama com jeito de primeira ministra .,"[False, False, False, False, False, False, True, False, False, False, False, False, False]",Jorginho conta que Luviana é uma primeira-dama com jeito de primeira ministra .,"[True, True, True, True, True, True, True, True, True, True, True, True, True]",Jorginho conta que Luviana é uma primeira com jeito de primeira ministra .,"[False, False, False, False, False, False, True, False, False, False, False, False, False]",Jorginho conta que Luviana é uma dama com jeito de primeira ministra .,"[False, False, False, False, False, False, True, False, False, False, False, False, False]",Jorginho conta que Luviana é uma dama normal com jeito de primeira ministra .,"[False, False, False, False, False, False, True, True, False, False, False, False, False, False]",Jorginho conta que Luviana é uma primeira coisa com jeito de primeira ministra .,"[False, False, False, False, False, False, True, True, False, False, False, False, False, False]",Jorginho conta que Luviana é uma primeira mulher com jeito de primeira ministra .,"[False, False, False, False, False, False, True, True, False, False, False, False, False, False]",Jorginho conta que Luviana é uma dama inicial com jeito de primeira ministra .,"[False, False, False, False, False, False, True, True, False, False, False, False, False, False]",Jorginho conta que Luviana é uma mulher inicial com jeito de primeira ministra .,"[False, False, False, False, False, False, True, True, False, False, False, False, False, False]",Jorginho conta que Luviana é uma esposa do presidente com jeito de primeira ministra .,"[False, False, False, False, False, False, True, True, True, False, False, False, False, False, False]",Jorginho conta que Luviana é um pimentão vermelho com jeito de primeira ministra .,"[False, False, False, False, False, False, True, True, False, False, False, False, False, False]",Jorginho conta que Luviana é uma reta final com jeito de primeira ministra .,"[False, False, False, False, False, False, True, True, False, False, False, False, False, False]",Jorginho conta que Luviana é um arquivo russo com jeito de primeira ministra .,"[False, False, False, False, False, False, True, True, False, False, False, False, False, False]",Jorginho conta que Luviana é uma cerca viva com jeito de primeira ministra .,"[False, False, False, False, False, False, True, True, False, False, False, False, False, False]",Jorginho conta que Luviana é um mandato inequívoco com jeito de primeira ministra .,"[False, False, False, False, False, False, True, True, False, False, False, False, False, False]",Jorginho conta que Luviana é uma corda bamba com jeito de primeira ministra .,"[False, False, False, False, False, False, True, True, False, False, False, False, False, False]",Jorginho conta que Luviana é uma universo adulto com jeito de primeira ministra .,"[False, False, False, False, False, False, True, True, False, False, False, False, False, False]",Jorginho conta que Luviana é uma farinha integral com jeito de primeira ministra .,"[False, False, False, False, False, False, True, True, False, False, False, False, False, False]",Jorginho conta que Luviana é um mero episódio com jeito de primeira ministra .,"[False, False, False, False, False, False, True, True, False, False, False, False, False, False]",Jorginho conta que Luviana é uma fila indiana com jeito de primeira ministra .,"[False, False, False, False, False, False, True, True, False, False, False, False, False, False]"
primeiro ministro,primeiro ministro,"[True, True]",Considere - se o primeiro ministro britânico David Cameron .,"[False, False, False, False, True, True, False, False, False, False]",Considere - se o primeiro ministro britânico David Cameron .,"[True, True, True, True, True, True, True, True, True, True]",Considere - se o primeiro britânico David Cameron .,"[False, False, False, False, True, False, False, False, False]",Considere - se o ministro britânico David Cameron .,"[False, False, False, False, True, False, False, False, False]",Considere - se o ministro normal britânico David Cameron .,"[False, False, False, False, True, True, False, False, False, False]",Considere - se o primeiro coiso britânico David Cameron .,"[False, False, False, False, True, True, False, False, False, False]",Considere - se o primeiro servidor britânico David Cameron .,"[False, False, False, False, True, True, False, False, False, False]",Considere - se o ministro inicial britânico David Cameron .,"[False, False, False, False, True, True, False, False, False, False]",Considere - se o servidor inicial britânico David Cameron .,"[False, False, False, False, True, True, False, False, False, False]",Considere - se o chefe de estado britânico David Cameron .,"[False, False, False, False, True, True, True, False, False, False, False]",Considere - se o texto simples britânico David Cameron .,"[False, False, False, False, True, True, False, False, False, False]",Considere - se o pastor alemão britânico David Cameron .,"[False, False, False, False, True, True, False, False, False, False]",Considere - se os feriados nacionais britânicos David Cameron .,"[False, False, False, False, True, True, False, False, False, False]",Considere - se o voto secreto britânico David Cameron .,"[False, False, False, False, True, True, False, False, False, False]",Considere - se a relação longa britânica David Cameron .,"[False, False, False, False, True, True, False, False, False, False]",Considere - se o pau-mandado britânico David Cameron .,"[False, False, False, False, True, False, False, False, False]",Considere - se a pequena excursão britânica David Cameron .,"[False, False, False, False, True, True, False, False, False, False]",Considere - se o prato feito britânico David Cameron .,"[False, False, False, False, True, True, False, False, False, False]",Considere - se as abordagens políticas britânicas David Cameron .,"[False, False, False, False, True, True, False, False, False, False]",Considere - se o livro aberto britânico David Cameron .,"[False, False, False, False, True, True, False, False, False, False]"
primeiro plano,primeiro plano,"[True, True]",Eu realmente consigo trazer a emoção para o primeiro plano .,"[False, False, False, False, False, False, False, False, True, True, False]",Eu realmente consigo trazer a emoção para o primeiro plano .,"[True, True, True, True, True, True, True, True, True, True, True]",Eu realmente consigo trazer a emoção para o primeiro .,"[False, False, False, False, False, False, False, False, True, False]",Eu realmente consigo trazer a emoção para o plano .,"[False, False, False, False, False, False, False, False, True, False]",Eu realmente consigo trazer a emoção para o plano normal .,"[False, False, False, False, False, False, False, False, True, True, False]",Eu realmente consigo trazer a emoção para o primeiro coiso .,"[False, False, False, False, False, False, False, False, True, True, False]",Eu realmente consigo trazer a emoção para o primeiro nível .,"[False, False, False, False, False, False, False, False, True, True, False]",Eu realmente consigo trazer a emoção para o plano inicial .,"[False, False, False, False, False, False, False, False, True, True, False]",Eu realmente consigo trazer a emoção para o nível inicial .,"[False, False, False, False, False, False, False, False, True, True, False]",Eu realmente consigo trazer a emoção para a prioridade .,"[False, False, False, False, False, False, False, False, True, False]",Eu realmente consigo trazer a emoção para a bolsa mundial .,"[False, False, False, False, False, False, False, False, True, True, False]",Eu realmente consigo trazer a emoção para o primeiro ministro .,"[False, False, False, False, False, False, False, False, True, True, False]",Eu realmente consigo trazer a emoção para as pessoas antigas .,"[False, False, False, False, False, False, False, False, True, True, False]",Eu realmente consigo trazer a emoção para o pé-frio .,"[False, False, False, False, False, False, False, False, True, False]",Eu realmente consigo trazer a emoção para os melhores golfistas .,"[False, False, False, False, False, False, False, False, True, True, False]",Eu realmente consigo trazer a emoção para o bode expiatório .,"[False, False, False, False, False, False, False, False, True, True, False]",Eu realmente consigo trazer a emoção para o físico francês .,"[False, False, False, False, False, False, False, False, True, True, False]",Eu realmente consigo trazer a emoção para o longa-metragem .,"[False, False, False, False, False, False, False, False, True, False]",Eu realmente consigo trazer a emoção para o vice rei .,"[False, False, False, False, False, False, False, False, True, True, False]",Eu realmente consigo trazer a emoção para o círculo virtuoso .,"[False, False, False, False, False, False, False, False, True, True, False]"
príncipe encantado,príncipe encantado,"[True, True]","Eu nunca esperei um príncipe encantado pelo contrário , sempre achei os sapos mais interessantes !","[False, False, False, False, True, True, False, False, False, False, False, False, False, False, False, False]","Eu nunca esperei um príncipe encantado pelo contrário , sempre achei os sapos mais interessantes !","[True, True, True, True, True, True, True, True, True, True, True, True, True, True, True, True]","Eu nunca esperei um príncipe pelo contrário , sempre achei os sapos mais interessantes !","[False, False, False, False, True, False, False, False, False, False, False, False, False, False, False]","Eu nunca esperei um encantado pelo contrário , sempre achei os sapos mais interessantes !","[False, False, False, False, True, False, False, False, False, False, False, False, False, False, False]","Eu nunca esperei um príncipe normal pelo contrário , sempre achei os sapos mais interessantes !","[False, False, False, False, True, True, False, False, False, False, False, False, False, False, False, False]","Eu nunca esperei um coiso encantado pelo contrário , sempre achei os sapos mais interessantes !","[False, False, False, False, True, True, False, False, False, False, False, False, False, False, False, False]","Eu nunca esperei um príncipe enfeitiçado pelo contrário , sempre achei os sapos mais interessantes !","[False, False, False, False, True, True, False, False, False, False, False, False, False, False, False, False]","Eu nunca esperei um infante encantado pelo contrário , sempre achei os sapos mais interessantes !","[False, False, False, False, True, True, False, False, False, False, False, False, False, False, False, False]","Eu nunca esperei um infante enfeitiçado pelo contrário , sempre achei os sapos mais interessantes !","[False, False, False, False, True, True, False, False, False, False, False, False, False, False, False, False]","Eu nunca esperei um homem perfeito pelo contrário , sempre achei os sapos mais interessantes !","[False, False, False, False, True, True, False, False, False, False, False, False, False, False, False, False]","Eu nunca esperei um dogo argentino pelo contrário , sempre achei os sapos mais interessantes !","[False, False, False, False, True, True, False, False, False, False, False, False, False, False, False, False]","Eu nunca esperei um tapete vermelho pelo contrário , sempre achei os sapos mais interessantes !","[False, False, False, False, True, True, False, False, False, False, False, False, False, False, False, False]","Eu nunca esperei umas indústrias argentinas pelo contrário , sempre achei os sapos mais interessantes !","[False, False, False, False, True, True, False, False, False, False, False, False, False, False, False, False]","Eu nunca esperei um papel higiênico pelo contrário , sempre achei os sapos mais interessantes !","[False, False, False, False, True, True, False, False, False, False, False, False, False, False, False, False]","Eu nunca esperei umas verdadeiras batalhas pelo contrário , sempre achei os sapos mais interessantes !","[False, False, False, False, True, True, False, False, False, False, False, False, False, False, False, False]","Eu nunca esperei um exame clínico pelo contrário , sempre achei os sapos mais interessantes !","[False, False, False, False, True, True, False, False, False, False, False, False, False, False, False, False]","Eu nunca esperei um litoral nortenho pelo contrário , sempre achei os sapos mais interessantes !","[False, False, False, False, True, True, False, False, False, False, False, False, False, False, False, False]","Eu nunca esperei um ar livre pelo contrário , sempre achei os sapos mais interessantes !","[False, False, False, False, True, True, False, False, False, False, False, False, False, False, False, False]","Eu nunca esperei um desfecho favorável pelo contrário , sempre achei os sapos mais interessantes !","[False, False, False, False, True, True, False, False, False, False, False, False, False, False, False, False]","Eu nunca esperei um círculo vicioso pelo contrário , sempre achei os sapos mais interessantes !","[False, False, False, False, True, True, False, False, False, False, False, False, False, False, False, False]"
processo seletivo,processo seletivo,"[True, True]",As inscrições para o processo seletivo são gratuitas .,"[False, False, False, False, True, True, False, False, False]",As inscrições para o processo seletivo são gratuitas .,"[True, True, True, True, True, True, True, True, True]",As inscrições para o processo são gratuitas .,"[False, False, False, False, True, False, False, False]",As inscrições para o seletivo são gratuitas .,"[False, False, False, False, True, False, False, False]",As inscrições para o processo normal são gratuitas .,"[False, False, False, False, True, True, False, False, False]",As inscrições para o coiso seletivo são gratuitas .,"[False, False, False, False, True, True, False, False, False]",As inscrições para o processo selecionado são gratuitas .,"[False, False, False, False, True, True, False, False, False]",As inscrições para o procedimento seletivo são gratuitas .,"[False, False, False, False, True, True, False, False, False]",As inscrições para o procedimento selecionado são gratuitas .,"[False, False, False, False, True, True, False, False, False]",As inscrições para a seleção são gratuitas .,"[False, False, False, False, True, False, False, False]",As inscrições para o noroeste português são gratuitas .,"[False, False, False, False, True, True, False, False, False]",As inscrições para o alto mar são gratuitas .,"[False, False, False, False, True, True, False, False, False]",As inscrições para o actual montante são gratuitas .,"[False, False, False, False, True, True, False, False, False]",As inscrições para o peso morto são gratuitas .,"[False, False, False, False, True, True, False, False, False]",As inscrições para o artista comercial são gratuitas .,"[False, False, False, False, True, True, False, False, False]",As inscrições para o primeiro ministro são gratuitas .,"[False, False, False, False, True, True, False, False, False]",As inscrições para o pintor real são gratuitas .,"[False, False, False, False, True, True, False, False, False]",As inscrições para o ar livre são gratuitas .,"[False, False, False, False, True, True, False, False, False]",As inscrições para a música bretã são gratuitas .,"[False, False, False, False, True, True, False, False, False]",As inscrições para o trabalho escravo são gratuitas .,"[False, False, False, False, True, True, False, False, False]"
pronto-socorro,pronto-socorro,[True],A explosão acabou com 18 hospitais e 32 postos de pronto-socorro .,"[False, False, False, False, False, False, False, False, False, False, True, False]",A explosão acabou com 18 hospitais e 32 postos de pronto-socorro .,"[True, True, True, True, True, True, True, True, True, True, True, True]",A explosão acabou com 18 hospitais e 32 postos de pronto .,"[False, False, False, False, False, False, False, False, False, False, True, False]",A explosão acabou com 18 hospitais e 32 postos de socorro .,"[False, False, False, False, False, False, False, False, False, False, True, False]",A explosão acabou com 18 hospitais e 32 postos de socorro normal .,"[False, False, False, False, False, False, False, False, False, False, True, True, False]",A explosão acabou com 18 hospitais e 32 postos de pronto coiso .,"[False, False, False, False, False, False, False, False, False, False, True, True, False]",A explosão acabou com 18 hospitais e 32 postos de assistência pronta .,"[False, False, False, False, False, False, False, False, False, False, True, True, False]",A explosão acabou com 18 hospitais e 32 postos de socorro rápido .,"[False, False, False, False, False, False, False, False, False, False, True, True, False]",A explosão acabou com 18 hospitais e 32 postos de assistência rápida .,"[False, False, False, False, False, False, False, False, False, False, True, True, False]",A explosão acabou com 18 hospitais e 32 postos de hospital .,"[False, False, False, False, False, False, False, False, False, False, True, False]",A explosão acabou com 18 hospitais e 32 postos de rodas cinematográficas .,"[False, False, False, False, False, False, False, False, False, False, True, True, False]",A explosão acabou com 18 hospitais e 32 postos de algodão-doce .,"[False, False, False, False, False, False, False, False, False, False, True, False]",A explosão acabou com 18 hospitais e 32 postos de juntas revolucionárias .,"[False, False, False, False, False, False, False, False, False, False, True, True, False]",A explosão acabou com 18 hospitais e 32 postos de prato feito .,"[False, False, False, False, False, False, False, False, False, False, True, True, False]",A explosão acabou com 18 hospitais e 32 postos de fotos nítidas .,"[False, False, False, False, False, False, False, False, False, False, True, True, False]",A explosão acabou com 18 hospitais e 32 postos de leite integral .,"[False, False, False, False, False, False, False, False, False, False, True, True, False]",A explosão acabou com 18 hospitais e 32 postos de impulsos telefónicos .,"[False, False, False, False, False, False, False, False, False, False, True, True, False]",A explosão acabou com 18 hospitais e 32 postos de livro aberto .,"[False, False, False, False, False, False, False, False, False, False, True, True, False]",A explosão acabou com 18 hospitais e 32 postos de proeminentes advogados .,"[False, False, False, False, False, False, False, False, False, False, True, True, False]",A explosão acabou com 18 hospitais e 32 postos de voto secreto .,"[False, False, False, False, False, False, False, False, False, False, True, True, False]"
puro-sangue,puros-sangues,[True],Que fazer se os outros cavalos grandes e puros-sangues tinham toda a prioridade ?,"[False, False, False, False, False, False, False, False, True, False, False, False, False, False]",Que fazer se os outros cavalos grandes e puros-sangues tinham toda a prioridade ?,"[True, True, True, True, True, True, True, True, True, True, True, True, True, True]",Que fazer se os outros cavalos grandes e puros tinham toda a prioridade ?,"[False, False, False, False, False, False, False, False, True, False, False, False, False, False]",Que fazer se os outros cavalos grandes e sangues tinham toda a prioridade ?,"[False, False, False, False, False, False, False, False, True, False, False, False, False, False]",Que fazer se os outros cavalos grandes e sangues normais tinham toda a prioridade ?,"[False, False, False, False, False, False, False, False, True, True, False, False, False, False, False]",Que fazer se os outros cavalos grandes e coisas puras tinham toda a prioridade ?,"[False, False, False, False, False, False, False, False, True, True, False, False, False, False, False]",Que fazer se os outros cavalos grandes e plasmas puros tinham toda a prioridade ?,"[False, False, False, False, False, False, False, False, True, True, False, False, False, False, False]",Que fazer se os outros cavalos grandes e sangue autêntico tinham toda a prioridade ?,"[False, False, False, False, False, False, False, False, True, True, False, False, False, False, False]",Que fazer se os outros cavalos grandes e plasma autêntico tinham toda a prioridade ?,"[False, False, False, False, False, False, False, False, True, True, False, False, False, False, False]",Que fazer se os outros cavalos grandes e de raça tinham toda a prioridade ?,"[False, False, False, False, False, False, False, False, True, True, False, False, False, False, False]",Que fazer se os outros cavalos grandes e danos irreparáveis tinham toda a prioridade ?,"[False, False, False, False, False, False, False, False, True, True, False, False, False, False, False]",Que fazer se os outros cavalos grandes e pontos fortes tinham toda a prioridade ?,"[False, False, False, False, False, False, False, False, True, True, False, False, False, False, False]",Que fazer se os outros cavalos grandes e presidenciais alemãs tinham toda a prioridade ?,"[False, False, False, False, False, False, False, False, True, True, False, False, False, False, False]",Que fazer se os outros cavalos grandes e banhos turcos tinham toda a prioridade ?,"[False, False, False, False, False, False, False, False, True, True, False, False, False, False, False]",Que fazer se os outros cavalos grandes e protecções adequadas tinham toda a prioridade ?,"[False, False, False, False, False, False, False, False, True, True, False, False, False, False, False]",Que fazer se os outros cavalos grandes e centros comerciais tinham toda a prioridade ?,"[False, False, False, False, False, False, False, False, True, True, False, False, False, False, False]",Que fazer se os outros cavalos grandes e candidatos africanos tinham toda a prioridade ?,"[False, False, False, False, False, False, False, False, True, True, False, False, False, False, False]",Que fazer se os outros cavalos grandes e núcleos atómicos tinham toda a prioridade ?,"[False, False, False, False, False, False, False, False, True, True, False, False, False, False, False]",Que fazer se os outros cavalos grandes e filhos paralíticos tinham toda a prioridade ?,"[False, False, False, False, False, False, False, False, True, True, False, False, False, False, False]",Que fazer se os outros cavalos grandes e buracos negros tinham toda a prioridade ?,"[False, False, False, False, False, False, False, False, True, True, False, False, False, False, False]"
quadro-negro,quadro-negro,[True],Quando muito diríamos que só são entes de giz no quadro-negro .,"[False, False, False, False, False, False, False, False, False, False, True, False]",Quando muito diríamos que só são entes de giz no quadro-negro .,"[True, True, True, True, True, True, True, True, True, True, True, True]",Quando muito diríamos que só são entes de giz no quadro .,"[False, False, False, False, False, False, False, False, False, False, True, False]",Quando muito diríamos que só são entes de giz no negro .,"[False, False, False, False, False, False, False, False, False, False, True, False]",Quando muito diríamos que só são entes de giz no quadro normal .,"[False, False, False, False, False, False, False, False, False, False, True, True, False]",Quando muito diríamos que só são entes de giz no coiso negro .,"[False, False, False, False, False, False, False, False, False, False, True, True, False]",Quando muito diríamos que só são entes de giz no quadro preto .,"[False, False, False, False, False, False, False, False, False, False, True, True, False]",Quando muito diríamos que só são entes de giz no painel negro .,"[False, False, False, False, False, False, False, False, False, False, True, True, False]",Quando muito diríamos que só são entes de giz no painel preto .,"[False, False, False, False, False, False, False, False, False, False, True, True, False]",Quando muito diríamos que só são entes de giz na lousa .,"[False, False, False, False, False, False, False, False, False, False, True, False]",Quando muito diríamos que só são entes de giz no líder sudanês .,"[False, False, False, False, False, False, False, False, False, False, True, True, False]",Quando muito diríamos que só são entes de giz no pé-frio .,"[False, False, False, False, False, False, False, False, False, False, True, False]",Quando muito diríamos que só são entes de giz no modo inverso .,"[False, False, False, False, False, False, False, False, False, False, True, True, False]",Quando muito diríamos que só são entes de giz no elefante branco .,"[False, False, False, False, False, False, False, False, False, False, True, True, False]",Quando muito diríamos que só são entes de giz na preparação cultural .,"[False, False, False, False, False, False, False, False, False, False, True, True, False]",Quando muito diríamos que só são entes de giz no pavio curto .,"[False, False, False, False, False, False, False, False, False, False, True, True, False]",Quando muito diríamos que só são entes de giz nos próprios indicadores .,"[False, False, False, False, False, False, False, False, False, False, True, True, False]",Quando muito diríamos que só são entes de giz no céu aberto .,"[False, False, False, False, False, False, False, False, False, False, True, True, False]",Quando muito diríamos que só são entes de giz na realidade fiscal .,"[False, False, False, False, False, False, False, False, False, False, True, True, False]",Quando muito diríamos que só são entes de giz no governo federal .,"[False, False, False, False, False, False, False, False, False, False, True, True, False]"
