primeira necessidade,primeira necessidade,"[True, True]","Na ordem de prioridade dos usos da água , essa é a primeira necessidade a ser atendida .","[False, False, False, False, False, False, False, False, False, False, False, False, True, True, False, False, False, False]","Na ordem de prioridade dos usos da água , essa é a primeira necessidade a ser atendida .","[True, True, True, True, True, True, True, True, True, True, True, True, True, True, True, True, True, True]","Na ordem de prioridade dos usos da água , essa é a primeira a ser atendida .","[False, False, False, False, False, False, False, False, False, False, False, False, True, False, False, False, False]","Na ordem de prioridade dos usos da água , essa é a necessidade a ser atendida .","[False, False, False, False, False, False, False, False, False, False, False, False, True, False, False, False, False]","Na ordem de prioridade dos usos da água , essa é a necessidade normal a ser atendida .","[False, False, False, False, False, False, False, False, False, False, False, False, True, True, False, False, False, False]","Na ordem de prioridade dos usos da água , essa é a primeira coisa a ser atendida .","[False, False, False, False, False, False, False, False, False, False, False, False, True, True, False, False, False, False]","Na ordem de prioridade dos usos da água , essa é a primeira exigência a ser atendida .","[False, False, False, False, False, False, False, False, False, False, False, False, True, True, False, False, False, False]","Na ordem de prioridade dos usos da água , essa é a necessidade inicial a ser atendida .","[False, False, False, False, False, False, False, False, False, False, False, False, True, True, False, False, False, False]","Na ordem de prioridade dos usos da água , essa é a exigência inicial a ser atendida .","[False, False, False, False, False, False, False, False, False, False, False, False, True, True, False, False, False, False]","Na ordem de prioridade dos usos da água , essa é a prioridade a ser atendida .","[False, False, False, False, False, False, False, False, False, False, False, False, True, False, False, False, False]","Na ordem de prioridade dos usos da água , essa é a razão egoísta a ser atendida .","[False, False, False, False, False, False, False, False, False, False, False, False, True, True, False, False, False, False]","Na ordem de prioridade dos usos da água , essa é a reta final a ser atendida .","[False, False, False, False, False, False, False, False, False, False, False, False, True, True, False, False, False, False]","Na ordem de prioridade dos usos da água , essa é a companhia subsidiária a ser atendida .","[False, False, False, False, False, False, False, False, False, False, False, False, True, True, False, False, False, False]","Na ordem de prioridade dos usos da água , essa é a gripe aviária a ser atendida .","[False, False, False, False, False, False, False, False, False, False, False, False, True, True, False, False, False, False]","Na ordem de prioridade dos usos da água , essas são as estruturas competitivas a serem atendidas .","[False, False, False, False, False, False, False, False, False, False, False, False, True, True, False, False, False, False]","Na ordem de prioridade dos usos da água , essa é a má-fé a ser atendida .","[False, False, False, False, False, False, False, False, False, False, False, False, True, False, False, False, False]","Na ordem de prioridade dos usos da água , esses são os materiais abrasivos a serem atendidos .","[False, False, False, False, False, False, False, False, False, False, False, False, True, True, False, False, False, False]","Na ordem de prioridade dos usos da água , essa é a água doce a ser atendida .","[False, False, False, False, False, False, False, False, False, False, False, False, True, True, False, False, False, False]","Na ordem de prioridade dos usos da água , essa é a ação ininterrupta a ser atendida .","[False, False, False, False, False, False, False, False, False, False, False, False, True, True, False, False, False, False]","Na ordem de prioridade dos usos da água , essa é a tartaruga-marinha a ser atendida .","[False, False, False, False, False, False, False, False, False, False, False, False, True, False, False, False, False]"
primeira-dama,primeira-dama,[True],Foram padrinhos o prefeito e a primeira-dama de Patrocínio Paulista .,"[False, False, False, False, False, False, True, False, False, False, False]",Foram padrinhos o prefeito e a primeira-dama de Patrocínio Paulista .,"[True, True, True, True, True, True, True, True, True, True, True]",Foram padrinhos o prefeito e a primeira de Patrocínio Paulista .,"[False, False, False, False, False, False, True, False, False, False, False]",Foram padrinhos o prefeito e a dama de Patrocínio Paulista .,"[False, False, False, False, False, False, True, False, False, False, False]",Foram padrinhos o prefeito e a dama normal de Patrocínio Paulista .,"[False, False, False, False, False, False, True, True, False, False, False, False]",Foram padrinhos o prefeito e a primeira coisa de Patrocínio Paulista .,"[False, False, False, False, False, False, True, True, False, False, False, False]",Foram padrinhos o prefeito e a primeira mulher de Patrocínio Paulista .,"[False, False, False, False, False, False, True, True, False, False, False, False]",Foram padrinhos o prefeito e a dama inicial de Patrocínio Paulista .,"[False, False, False, False, False, False, True, True, False, False, False, False]",Foram padrinhos o prefeito e a mulher inicial de Patrocínio Paulista .,"[False, False, False, False, False, False, True, True, False, False, False, False]",Foram padrinhos o prefeito e a esposa do presidente de Patrocínio Paulista .,"[False, False, False, False, False, False, True, True, True, False, False, False, False]",Foram padrinhos o prefeito e o pimentão vermelho de Patrocínio Paulista .,"[False, False, False, False, False, False, True, True, False, False, False, False]",Foram padrinhos o prefeito e a tartaruga-marinha de Patrocínio Paulista .,"[False, False, False, False, False, False, True, False, False, False, False]",Foram padrinhos o prefeito e os arquivos russos de Patrocínio Paulista .,"[False, False, False, False, False, False, True, True, False, False, False, False]",Foram padrinhos o prefeito e a febre amarela de Patrocínio Paulista .,"[False, False, False, False, False, False, True, True, False, False, False, False]",Foram padrinhos o prefeito e o mandato inequívoco de Patrocínio Paulista .,"[False, False, False, False, False, False, True, True, False, False, False, False]",Foram padrinhos o prefeito e a gripe suína de Patrocínio Paulista .,"[False, False, False, False, False, False, True, True, False, False, False, False]",Foram padrinhos o prefeito e os veículos sujeitos de Patrocínio Paulista .,"[False, False, False, False, False, False, True, True, False, False, False, False]",Foram padrinhos o prefeito e a batata-doce de Patrocínio Paulista .,"[False, False, False, False, False, False, True, False, False, False, False]",Foram padrinhos o prefeito e o mero episódio de Patrocínio Paulista .,"[False, False, False, False, False, False, True, True, False, False, False, False]",Foram padrinhos o prefeito e a primeira necessidade de Patrocínio Paulista .,"[False, False, False, False, False, False, True, True, False, False, False, False]"
primeiro ministro,primeiro ministro,"[True, True]",Sócrates foi um péssimo primeiro ministro ?,"[False, False, False, False, True, True, False]",Sócrates foi um péssimo primeiro ministro ?,"[True, True, True, True, True, True, True]",Sócrates foi um péssimo primeiro ?,"[False, False, False, False, True, False]",Sócrates foi um péssimo ministro ?,"[False, False, False, False, True, False]",Sócrates foi um péssimo ministro normal ?,"[False, False, False, False, True, True, False]",Sócrates foi um péssimo primeiro coiso ?,"[False, False, False, False, True, True, False]",Sócrates foi um péssimo primeiro servidor ?,"[False, False, False, False, True, True, False]",Sócrates foi um péssimo ministro inicial ?,"[False, False, False, False, True, True, False]",Sócrates foi um péssimo servidor inicial ?,"[False, False, False, False, True, True, False]",Sócrates foi um péssimo chefe de estado ?,"[False, False, False, False, True, True, True, False]",Sócrates foi um péssimo texto simples ?,"[False, False, False, False, True, True, False]",Sócrates foi um péssimo relógio analógico ?,"[False, False, False, False, True, True, False]",Sócrates foi um péssimo antigo compositor ?,"[False, False, False, False, True, True, False]",Sócrates foi um péssimo prato feito ?,"[False, False, False, False, True, True, False]",Sócrates foi uma péssima relação longa ?,"[False, False, False, False, True, True, False]",Sócrates foi um péssimo pronto-socorro ?,"[False, False, False, False, True, False]",Sócrates foi uma péssima pequena excursão ?,"[False, False, False, False, True, True, False]",Sócrates foi um péssimo livro aberto ?,"[False, False, False, False, True, True, False]",Sócrates foi um péssimo papel amarelo ?,"[False, False, False, False, True, True, False]",Sócrates foi um péssimo tapete vermelho ?,"[False, False, False, False, True, True, False]"
primeiro plano,primeiro plano,"[True, True]",Um primeiro plano mostra a tensão de seu semblante .,"[False, True, True, False, False, False, False, False, False, False]",Um primeiro plano mostra a tensão de seu semblante .,"[True, True, True, True, True, True, True, True, True, True]",Um primeiro mostra a tensão de seu semblante .,"[False, True, False, False, False, False, False, False, False]",Um plano mostra a tensão de seu semblante .,"[False, True, False, False, False, False, False, False, False]",Um plano normal mostra a tensão de seu semblante .,"[False, True, True, False, False, False, False, False, False, False]",Um primeiro coiso mostra a tensão de seu semblante .,"[False, True, True, False, False, False, False, False, False, False]",Um primeiro nível mostra a tensão de seu semblante .,"[False, True, True, False, False, False, False, False, False, False]",Um plano inicial mostra a tensão de seu semblante .,"[False, True, True, False, False, False, False, False, False, False]",Um nível inicial mostra a tensão de seu semblante .,"[False, True, True, False, False, False, False, False, False, False]",Um destaque mostra a tensão de seu semblante .,"[False, True, False, False, False, False, False, False, False]",Uma bolsa mundial mostra a tensão de seu semblante .,"[False, True, True, False, False, False, False, False, False, False]",Um jogo duro mostra a tensão de seu semblante .,"[False, True, True, False, False, False, False, False, False, False]",Umas pessoas antigas mostram a tensão de seu semblante .,"[False, True, True, False, False, False, False, False, False, False]",Um pé-direito mostra a tensão de seu semblante .,"[False, True, False, False, False, False, False, False, False]",Uns melhores golfistas mostram a tensão de seu semblante .,"[False, True, True, False, False, False, False, False, False, False]",Um amigo oculto mostra a tensão de seu semblante .,"[False, True, True, False, False, False, False, False, False, False]",Um físico francês mostra a tensão de seu semblante .,"[False, True, True, False, False, False, False, False, False, False]",Um sangue frio mostra a tensão de seu semblante .,"[False, True, True, False, False, False, False, False, False, False]",Um vice rei mostra a tensão de seu semblante .,"[False, True, True, False, False, False, False, False, False, False]",Um centro espírita mostra a tensão de seu semblante .,"[False, True, True, False, False, False, False, False, False, False]"
príncipe encantado,príncipe encantado,"[True, True]",Elas ainda são criadas para acreditar no príncipe encantado .,"[False, False, False, False, False, False, False, True, True, False]",Elas ainda são criadas para acreditar no príncipe encantado .,"[True, True, True, True, True, True, True, True, True, True]",Elas ainda são criadas para acreditar no príncipe .,"[False, False, False, False, False, False, False, True, False]",Elas ainda são criadas para acreditar no encantado .,"[False, False, False, False, False, False, False, True, False]",Elas ainda são criadas para acreditar no príncipe normal .,"[False, False, False, False, False, False, False, True, True, False]",Elas ainda são criadas para acreditar no coiso encantado .,"[False, False, False, False, False, False, False, True, True, False]",Elas ainda são criadas para acreditar no príncipe enfeitiçado .,"[False, False, False, False, False, False, False, True, True, False]",Elas ainda são criadas para acreditar no infante encantado .,"[False, False, False, False, False, False, False, True, True, False]",Elas ainda são criadas para acreditar no infante enfeitiçado .,"[False, False, False, False, False, False, False, True, True, False]",Elas ainda são criadas para acreditar no homem perfeito .,"[False, False, False, False, False, False, False, True, True, False]",Elas ainda são criadas para acreditar nas guerras revolucionárias .,"[False, False, False, False, False, False, False, True, True, False]",Elas ainda são criadas para acreditar no céu aberto .,"[False, False, False, False, False, False, False, True, True, False]",Elas ainda são criadas para acreditar nas indústrias argentinas .,"[False, False, False, False, False, False, False, True, True, False]",Elas ainda são criadas para acreditar no banho turco .,"[False, False, False, False, False, False, False, True, True, False]",Elas ainda são criadas para acreditar nas verdadeiras batalhas .,"[False, False, False, False, False, False, False, True, True, False]",Elas ainda são criadas para acreditar no café colonial .,"[False, False, False, False, False, False, False, True, True, False]",Elas ainda são criadas para acreditar no litoral nortenho .,"[False, False, False, False, False, False, False, True, True, False]",Elas ainda são criadas para acreditar no primeiro plano .,"[False, False, False, False, False, False, False, True, True, False]",Elas ainda são criadas para acreditar no desfecho favorável .,"[False, False, False, False, False, False, False, True, True, False]",Elas ainda são criadas para acreditar no pé quente .,"[False, False, False, False, False, False, False, True, True, False]"
processo seletivo,processo seletivo,"[True, True]",Processo seletivo inclui entrevista pessoal .,"[True, True, False, False, False, False]",Processo seletivo inclui entrevista pessoal .,"[True, True, True, True, True, True]",Processo inclui entrevista pessoal .,"[True, False, False, False, False]",Seletivo inclui entrevista pessoal .,"[True, False, False, False, False]",Processo normal inclui entrevista pessoal .,"[True, True, False, False, False, False]",Coiso seletivo inclui entrevista pessoal .,"[True, True, False, False, False, False]",Processo selecionado inclui entrevista pessoal .,"[True, True, False, False, False, False]",Procedimento seletivo inclui entrevista pessoal .,"[True, True, False, False, False, False]",Procedimento selecionado inclui entrevista pessoal .,"[True, True, False, False, False, False]",Seleção inclui entrevista pessoal .,"[True, False, False, False, False]",Atual montante inclui entrevista pessoal .,"[True, True, False, False, False, False]",segundo plano inclui entrevista pessoal .,"[True, True, False, False, False, False]",Artista comercial inclui entrevista pessoal .,"[True, True, False, False, False, False]",ar condicionado inclui entrevista pessoal .,"[True, True, False, False, False, False]",Pintor real inclui entrevista pessoal .,"[True, True, False, False, False, False]",pé quente inclui entrevista pessoal .,"[True, True, False, False, False, False]",Música bretã inclui entrevista pessoal .,"[True, True, False, False, False, False]",fio condutor inclui entrevista pessoal .,"[True, True, False, False, False, False]",Noroeste português inclui entrevista pessoal .,"[True, True, False, False, False, False]",café colonial inclui entrevista pessoal .,"[True, True, False, False, False, False]"
pronto-socorro,pronto-socorro,[True],Há crianças que chegam esqueléticas ao pronto-socorro .,"[False, False, False, False, False, False, True, False]",Há crianças que chegam esqueléticas ao pronto-socorro .,"[True, True, True, True, True, True, True, True]",Há crianças que chegam esqueléticas ao pronto .,"[False, False, False, False, False, False, True, False]",Há crianças que chegam esqueléticas ao socorro .,"[False, False, False, False, False, False, True, False]",Há crianças que chegam esqueléticas ao socorro normal .,"[False, False, False, False, False, False, True, True, False]",Há crianças que chegam esqueléticas ao pronto coiso .,"[False, False, False, False, False, False, True, True, False]",Há crianças que chegam esqueléticas à assistência pronta .,"[False, False, False, False, False, False, True, True, False]",Há crianças que chegam esqueléticas ao socorro rápido .,"[False, False, False, False, False, False, True, True, False]",Há crianças que chegam esqueléticas à assistência rápida .,"[False, False, False, False, False, False, True, True, False]",Há crianças que chegam esqueléticas ao hospital .,"[False, False, False, False, False, False, True, False]",Há crianças que chegam esqueléticas às rodas cinematográficas .,"[False, False, False, False, False, False, True, True, False]",Há crianças que chegam esqueléticas ao deputado federal .,"[False, False, False, False, False, False, True, True, False]",Há crianças que chegam esqueléticas às juntas revolucionárias .,"[False, False, False, False, False, False, True, True, False]",Há crianças que chegam esqueléticas ao tapete vermelho .,"[False, False, False, False, False, False, True, True, False]",Há crianças que chegam esqueléticas às fotos nítidas .,"[False, False, False, False, False, False, True, True, False]",Há crianças que chegam esqueléticas ao alarme falso .,"[False, False, False, False, False, False, True, True, False]",Há crianças que chegam esqueléticas aos impulsos telefónicos .,"[False, False, False, False, False, False, True, True, False]",Há crianças que chegam esqueléticas ao alto mar .,"[False, False, False, False, False, False, True, True, False]",Há crianças que chegam esqueléticas aos proeminentes advogados .,"[False, False, False, False, False, False, True, True, False]",Há crianças que chegam esqueléticas ao paraíso fiscal .,"[False, False, False, False, False, False, True, True, False]"
puro-sangue,puro-sangue,[True],A paixão é como um legítimo cavalo puro-sangue .,"[False, False, False, False, False, False, False, True, False]",A paixão é como um legítimo cavalo puro-sangue .,"[True, True, True, True, True, True, True, True, True]",A paixão é como um legítimo cavalo puro .,"[False, False, False, False, False, False, False, True, False]",A paixão é como um legítimo cavalo sangue .,"[False, False, False, False, False, False, False, True, False]",A paixão é como um legítimo cavalo sangue normal .,"[False, False, False, False, False, False, False, True, True, False]",A paixão é como um legítimo cavalo puro coiso .,"[False, False, False, False, False, False, False, True, True, False]",A paixão é como um legítimo cavalo pura plasma .,"[False, False, False, False, False, False, False, True, True, False]",A paixão é como um legítimo cavalo sangue autêntico .,"[False, False, False, False, False, False, False, True, True, False]",A paixão é como um legítimo cavalo plasma autêntico .,"[False, False, False, False, False, False, False, True, True, False]",A paixão é como um legítimo cavalo de raça .,"[False, False, False, False, False, False, False, True, True, False]",A paixão é como um legítimo cavalo conjunto hidráulico .,"[False, False, False, False, False, False, False, True, True, False]",A paixão é como um legítimo cavalo colégio militar .,"[False, False, False, False, False, False, False, True, True, False]",A paixão é como um legítimo cavalo filho paralítico .,"[False, False, False, False, False, False, False, True, True, False]",A paixão é como um legítimo cavalo ano-novo .,"[False, False, False, False, False, False, False, True, False]",A paixão é como um legítimo cavalo manual básico .,"[False, False, False, False, False, False, False, True, True, False]",A paixão é como um legítimo cavalo tempo real .,"[False, False, False, False, False, False, False, True, True, False]",A paixão é como um legítimo cavalo agente intermediário .,"[False, False, False, False, False, False, False, True, True, False]",A paixão é como um legítimo cavalo pão-duro .,"[False, False, False, False, False, False, False, True, False]",A paixão é como um legítimo cavalo padrão artificial .,"[False, False, False, False, False, False, False, True, True, False]",A paixão é como um legítimo cavalo café colonial .,"[False, False, False, False, False, False, False, True, True, False]"
quadro-negro,quadro-negro,[True],O primeiro cardápio da rede era escrito em um quadro-negro .,"[False, False, False, False, False, False, False, False, False, True, False]",O primeiro cardápio da rede era escrito em um quadro-negro .,"[True, True, True, True, True, True, True, True, True, True, True]",O primeiro cardápio da rede era escrito em um quadro .,"[False, False, False, False, False, False, False, False, False, True, False]",O primeiro cardápio da rede era escrito em um negro .,"[False, False, False, False, False, False, False, False, False, True, False]",O primeiro cardápio da rede era escrito em um quadro normal .,"[False, False, False, False, False, False, False, False, False, True, True, False]",O primeiro cardápio da rede era escrito em um coiso negro .,"[False, False, False, False, False, False, False, False, False, True, True, False]",O primeiro cardápio da rede era escrito em um quadro preto .,"[False, False, False, False, False, False, False, False, False, True, True, False]",O primeiro cardápio da rede era escrito em um painel negro .,"[False, False, False, False, False, False, False, False, False, True, True, False]",O primeiro cardápio da rede era escrito em um painel preto .,"[False, False, False, False, False, False, False, False, False, True, True, False]",O primeiro cardápio da rede era escrito em uma lousa .,"[False, False, False, False, False, False, False, False, False, True, False]",O primeiro cardápio da rede era escrito em um líder sudanês .,"[False, False, False, False, False, False, False, False, False, True, True, False]",O primeiro cardápio da rede era escrito em um círculo vicioso .,"[False, False, False, False, False, False, False, False, False, True, True, False]",O primeiro cardápio da rede era escrito em um modo inverso .,"[False, False, False, False, False, False, False, False, False, True, True, False]",O primeiro cardápio da rede era escrito em um Pé-frio .,"[False, False, False, False, False, False, False, False, False, True, False]",O primeiro cardápio da rede era escrito em uma preparação cultural .,"[False, False, False, False, False, False, False, False, False, True, True, False]",O primeiro cardápio da rede era escrito em um bode expiatório .,"[False, False, False, False, False, False, False, False, False, True, True, False]",O primeiro cardápio da rede era escrito em uma difícil gestão .,"[False, False, False, False, False, False, False, False, False, True, True, False]",O primeiro cardápio da rede era escrito em um deputado federal .,"[False, False, False, False, False, False, False, False, False, True, True, False]",O primeiro cardápio da rede era escrito em uma realidade fiscal .,"[False, False, False, False, False, False, False, False, False, True, True, False]",O primeiro cardápio da rede era escrito em um carro-forte .,"[False, False, False, False, False, False, False, False, False, True, False]"
