coluna social,colunas sociais,"[True, True]",Seus rostos ilustram as colunas sociais e as revistas de fofocas revelam sua vida privada .,"[False, False, False, False, True, True, False, False, False, False, False, False, False, False, False, False]",Seus rostos ilustram as colunas sociais e as revistas de fofocas revelam sua vida privada .,"[True, True, True, True, True, True, True, True, True, True, True, True, True, True, True, True]",Seus rostos ilustram as colunas e as revistas de fofocas revelam sua vida privada .,"[False, False, False, False, True, False, False, False, False, False, False, False, False, False, False]",Seus rostos ilustram as sociais e as revistas de fofocas revelam sua vida privada .,"[False, False, False, False, True, False, False, False, False, False, False, False, False, False, False]",Seus rostos ilustram as colunas normais e as revistas de fofocas revelam sua vida privada .,"[False, False, False, False, True, True, False, False, False, False, False, False, False, False, False, False]",Seus rostos ilustram as coisas sociais e as revistas de fofocas revelam sua vida privada .,"[False, False, False, False, True, True, False, False, False, False, False, False, False, False, False, False]",Seus rostos ilustram as colunas comunitárias e as revistas de fofocas revelam sua vida privada .,"[False, False, False, False, True, True, False, False, False, False, False, False, False, False, False, False]",Seus rostos ilustram os pilares sociais e as revistas de fofocas revelam sua vida privada .,"[False, False, False, False, True, True, False, False, False, False, False, False, False, False, False, False]",Seus rostos ilustram os pilares comunitários e as revistas de fofocas revelam sua vida privada .,"[False, False, False, False, True, True, False, False, False, False, False, False, False, False, False, False]",Seus rostos ilustram as colunas de fofoca e as revistas de fofocas revelam sua vida privada .,"[False, False, False, False, True, True, True, False, False, False, False, False, False, False, False, False, False]",Seus rostos ilustram o regime brasileiro e as revistas de fofocas revelam sua vida privada .,"[False, False, False, False, True, True, False, False, False, False, False, False, False, False, False, False]",Seus rostos ilustram as bebidas alcoólicas e as revistas de fofocas revelam sua vida privada .,"[False, False, False, False, True, True, False, False, False, False, False, False, False, False, False, False]",Seus rostos ilustram a exposição seguinte e as revistas de fofocas revelam sua vida privada .,"[False, False, False, False, True, True, False, False, False, False, False, False, False, False, False, False]",Seus rostos ilustram as escadas rolantes e as revistas de fofocas revelam sua vida privada .,"[False, False, False, False, True, True, False, False, False, False, False, False, False, False, False, False]",Seus rostos ilustram a cooperação comercial e as revistas de fofocas revelam sua vida privada .,"[False, False, False, False, True, True, False, False, False, False, False, False, False, False, False, False]",Seus rostos ilustram as armas brancas e as revistas de fofocas revelam sua vida privada .,"[False, False, False, False, True, True, False, False, False, False, False, False, False, False, False, False]",Seus rostos ilustram as colônias francesas e as revistas de fofocas revelam sua vida privada .,"[False, False, False, False, True, True, False, False, False, False, False, False, False, False, False, False]",Seus rostos ilustram as carnes brancas e as revistas de fofocas revelam sua vida privada .,"[False, False, False, False, True, True, False, False, False, False, False, False, False, False, False, False]",Seus rostos ilustram a cidade rural e as revistas de fofocas revelam sua vida privada .,"[False, False, False, False, True, True, False, False, False, False, False, False, False, False, False, False]",Seus rostos ilustram as salas cirúrgicas e as revistas de fofocas revelam sua vida privada .,"[False, False, False, False, True, True, False, False, False, False, False, False, False, False, False, False]"
comida caseira,comida caseira,"[True, True]",Na passagem vimos uma plaquinha em uma casa anunciando comida caseira .,"[False, False, False, False, False, False, False, False, False, True, True, False]",Na passagem vimos uma plaquinha em uma casa anunciando comida caseira .,"[True, True, True, True, True, True, True, True, True, True, True, True]",Na passagem vimos uma plaquinha em uma casa anunciando comida .,"[False, False, False, False, False, False, False, False, False, True, False]",Na passagem vimos uma plaquinha em uma casa anunciando caseira .,"[False, False, False, False, False, False, False, False, False, True, False]",Na passagem vimos uma plaquinha em uma casa anunciando comida normal .,"[False, False, False, False, False, False, False, False, False, True, True, False]",Na passagem vimos uma plaquinha em uma casa anunciando coisa caseira .,"[False, False, False, False, False, False, False, False, False, True, True, False]",Na passagem vimos uma plaquinha em uma casa anunciando comida doméstica .,"[False, False, False, False, False, False, False, False, False, True, True, False]",Na passagem vimos uma plaquinha em uma casa anunciando alimento caseiro .,"[False, False, False, False, False, False, False, False, False, True, True, False]",Na passagem vimos uma plaquinha em uma casa anunciando alimento doméstico .,"[False, False, False, False, False, False, False, False, False, True, True, False]",Na passagem vimos uma plaquinha em uma casa anunciando comida feita em casa .,"[False, False, False, False, False, False, False, False, False, True, True, True, True, False]",Na passagem vimos uma plaquinha em uma casa anunciando pressões partidárias .,"[False, False, False, False, False, False, False, False, False, True, True, False]",Na passagem vimos uma plaquinha em uma casa anunciando longa data .,"[False, False, False, False, False, False, False, False, False, True, True, False]",Na passagem vimos uma plaquinha em uma casa anunciando princípio contabilístico .,"[False, False, False, False, False, False, False, False, False, True, True, False]",Na passagem vimos uma plaquinha em uma casa anunciando primeira-dama .,"[False, False, False, False, False, False, False, False, False, True, False]",Na passagem vimos uma plaquinha em uma casa anunciando cuidados clínicos .,"[False, False, False, False, False, False, False, False, False, True, True, False]",Na passagem vimos uma plaquinha em uma casa anunciando companhia aérea .,"[False, False, False, False, False, False, False, False, False, True, True, False]",Na passagem vimos uma plaquinha em uma casa anunciando discussões jurídicas .,"[False, False, False, False, False, False, False, False, False, True, True, False]",Na passagem vimos uma plaquinha em uma casa anunciando mesa-redonda .,"[False, False, False, False, False, False, False, False, False, True, False]",Na passagem vimos uma plaquinha em uma casa anunciando reflexão inteligente .,"[False, False, False, False, False, False, False, False, False, True, True, False]",Na passagem vimos uma plaquinha em uma casa anunciando saia justa .,"[False, False, False, False, False, False, False, False, False, True, True, False]"
companhia aérea,companhia aérea,"[True, True]",A Varig foi a primeira companhia aérea brasileira .,"[False, False, False, False, False, True, True, False, False]",A Varig foi a primeira companhia aérea brasileira .,"[True, True, True, True, True, True, True, True, True]",A Varig foi a primeira companhia brasileira .,"[False, False, False, False, False, True, False, False]",A Varig foi a primeira aérea brasileira .,"[False, False, False, False, False, True, False, False]",A Varig foi a primeira companhia normal brasileira .,"[False, False, False, False, False, True, True, False, False]",A Varig foi a primeira coisa aérea brasileira .,"[False, False, False, False, False, True, True, False, False]",A Varig foi a primeira companhia aeronáutica brasileira .,"[False, False, False, False, False, True, True, False, False]",A Varig foi a primeira empresa aérea brasileira .,"[False, False, False, False, False, True, True, False, False]",A Varig foi a primeira empresa aeronáutica brasileira .,"[False, False, False, False, False, True, True, False, False]",A Varig foi a primeira empresa aérea brasileira .,"[False, False, False, False, False, True, True, False, False]",A Varig foi o primeiro revezamento americano brasileira .,"[False, False, False, False, False, True, True, False, False]",A Varig foi a primeira carta aberta brasileira .,"[False, False, False, False, False, True, True, False, False]",A Varig foi o primeiro malogro total brasileira .,"[False, False, False, False, False, True, True, False, False]",A Varig foi a primeira primeira mão brasileira .,"[False, False, False, False, False, True, True, False, False]",A Varig foi o primeiro plano técnico brasileira .,"[False, False, False, False, False, True, True, False, False]",A Varig foi a primeira queda livre brasileira .,"[False, False, False, False, False, True, True, False, False]",A Varig foi o primeiro prazo restante brasileira .,"[False, False, False, False, False, True, True, False, False]",A Varig foi a primeira febre amarela brasileira .,"[False, False, False, False, False, True, True, False, False]",A Varig foi a primeira dissipação total brasileira .,"[False, False, False, False, False, True, True, False, False]",A Varig foi a primeira terceira idade brasileira .,"[False, False, False, False, False, True, True, False, False]"
conta-corrente,contas-correntes,[True],"Por exemplo , as transações ilegais de valores de contas-correntes .","[False, False, False, False, False, False, False, False, False, True, False]","Por exemplo , as transações ilegais de valores de contas-correntes .","[True, True, True, True, True, True, True, True, True, True, True]","Por exemplo , as transações ilegais de valores de contas .","[False, False, False, False, False, False, False, False, False, True, False]","Por exemplo , as transações ilegais de valores de correntes .","[False, False, False, False, False, False, False, False, False, True, False]","Por exemplo , as transações ilegais de valores de contas normais .","[False, False, False, False, False, False, False, False, False, True, True, False]","Por exemplo , as transações ilegais de valores de coisas correntes .","[False, False, False, False, False, False, False, False, False, True, True, False]","Por exemplo , as transações ilegais de valores de contas ordinárias .","[False, False, False, False, False, False, False, False, False, True, True, False]","Por exemplo , as transações ilegais de valores de contagens correntes .","[False, False, False, False, False, False, False, False, False, True, True, False]","Por exemplo , as transações ilegais de valores de contagens ordinárias .","[False, False, False, False, False, False, False, False, False, True, True, False]","Por exemplo , as transações ilegais de valores de contas bancárias .","[False, False, False, False, False, False, False, False, False, True, True, False]","Por exemplo , as transações ilegais de valores de antiga fortaleza .","[False, False, False, False, False, False, False, False, False, True, True, False]","Por exemplo , as transações ilegais de valores de luas nova .","[False, False, False, False, False, False, False, False, False, True, True, False]","Por exemplo , as transações ilegais de valores de devoção popular .","[False, False, False, False, False, False, False, False, False, True, True, False]","Por exemplo , as transações ilegais de valores de escadas rolantes .","[False, False, False, False, False, False, False, False, False, True, True, False]","Por exemplo , as transações ilegais de valores de ambiente amigável .","[False, False, False, False, False, False, False, False, False, True, True, False]","Por exemplo , as transações ilegais de valores de luas cheias .","[False, False, False, False, False, False, False, False, False, True, True, False]","Por exemplo , as transações ilegais de valores de valores iguais .","[False, False, False, False, False, False, False, False, False, True, True, False]","Por exemplo , as transações ilegais de valores de cordas vocais .","[False, False, False, False, False, False, False, False, False, True, True, False]","Por exemplo , as transações ilegais de valores de antiga orquestra .","[False, False, False, False, False, False, False, False, False, True, True, False]","Por exemplo , as transações ilegais de valores de bebidas alcoólicas .","[False, False, False, False, False, False, False, False, False, True, True, False]"
coração partido,coração partido,"[True, True]","Estou realmente destruída , com o meu coração partido .","[False, False, False, False, False, False, False, True, True, False]","Estou realmente destruída , com o meu coração partido .","[True, True, True, True, True, True, True, True, True, True]","Estou realmente destruída , com o meu coração .","[False, False, False, False, False, False, False, True, False]","Estou realmente destruída , com o meu partido .","[False, False, False, False, False, False, False, True, False]","Estou realmente destruída , com o meu coração normal .","[False, False, False, False, False, False, False, True, True, False]","Estou realmente destruída , com o meu coiso partido .","[False, False, False, False, False, False, False, True, True, False]","Estou realmente destruída , com o meu coração quebrado .","[False, False, False, False, False, False, False, True, True, False]","Estou realmente destruída , com a minha alma partida .","[False, False, False, False, False, False, False, True, True, False]","Estou realmente destruída , com a minha alma quebrada .","[False, False, False, False, False, False, False, True, True, False]","Estou realmente destruída , com uma decepção amorosa .","[False, False, False, False, False, False, True, True, False]","Estou realmente destruída , com o meu domínio inglês .","[False, False, False, False, False, False, False, True, True, False]","Estou realmente destruída , com o meu novo mundo .","[False, False, False, False, False, False, False, True, True, False]","Estou realmente destruída , com o meu caso escandaloso .","[False, False, False, False, False, False, False, True, True, False]","Estou realmente destruída , com o meu relógio biológico .","[False, False, False, False, False, False, False, True, True, False]","Estou realmente destruída , com o meu verdadeiro manual .","[False, False, False, False, False, False, False, True, True, False]","Estou realmente destruída , com o meu tapete vermelho .","[False, False, False, False, False, False, False, True, True, False]","Estou realmente destruída , com o meu dinâmico ambiente .","[False, False, False, False, False, False, False, True, True, False]","Estou realmente destruída , com o meu processo seletivo .","[False, False, False, False, False, False, False, True, True, False]","Estou realmente destruída , com a minha resposta inglesa .","[False, False, False, False, False, False, False, True, True, False]","Estou realmente destruída , com o meu bode expiatório .","[False, False, False, False, False, False, False, True, True, False]"
corda bamba,corda bamba,"[True, True]",É difícil viver o tempo todo nessa corda bamba .,"[False, False, False, False, False, False, False, True, True, False]",É difícil viver o tempo todo nessa corda bamba .,"[True, True, True, True, True, True, True, True, True, True]",É difícil viver o tempo todo nessa corda .,"[False, False, False, False, False, False, False, True, False]",É difícil viver o tempo todo nessa bamba .,"[False, False, False, False, False, False, False, True, False]",É difícil viver o tempo todo nessa corda normal .,"[False, False, False, False, False, False, False, True, True, False]",É difícil viver o tempo todo nessa coisa bamba .,"[False, False, False, False, False, False, False, True, True, False]",É difícil viver o tempo todo nessa corda lassa .,"[False, False, False, False, False, False, False, True, True, False]",É difícil viver o tempo todo nesse cabo bambo .,"[False, False, False, False, False, False, False, True, True, False]",É difícil viver o tempo todo nesse cabo lasso .,"[False, False, False, False, False, False, False, True, True, False]",É difícil viver o tempo todo nessa situação delicada .,"[False, False, False, False, False, False, False, True, True, False]",É difícil viver o tempo todo nessas flores murchas .,"[False, False, False, False, False, False, False, True, True, False]",É difícil viver o tempo todo nessa tela plana .,"[False, False, False, False, False, False, False, True, True, False]",É difícil viver o tempo todo nesses costumes tribais .,"[False, False, False, False, False, False, False, True, True, False]",É difícil viver o tempo todo nessa febre amarela .,"[False, False, False, False, False, False, False, True, True, False]",É difícil viver o tempo todo nessas construções inacabadas .,"[False, False, False, False, False, False, False, True, True, False]",É difícil viver o tempo todo nessa roleta russa .,"[False, False, False, False, False, False, False, True, True, False]",É difícil viver o tempo todo nesse idioma malaio .,"[False, False, False, False, False, False, False, True, True, False]",É difícil viver o tempo todo nessa vista grossa .,"[False, False, False, False, False, False, False, True, True, False]",É difícil viver o tempo todo nesses males espirituais .,"[False, False, False, False, False, False, False, True, True, False]",É difícil viver o tempo todo nessa sétima arte .,"[False, False, False, False, False, False, False, True, True, False]"
cordas vocais,cordas vocais,"[True, True]",A freqüência da voz é determinada pelas cordas vocais .,"[False, False, False, False, False, False, False, True, True, False]",A freqüência da voz é determinada pelas cordas vocais .,"[True, True, True, True, True, True, True, True, True, True]",A freqüência da voz é determinada pelas cordas .,"[False, False, False, False, False, False, False, True, False]",A freqüência da voz é determinada pelas vocais .,"[False, False, False, False, False, False, False, True, False]",A freqüência da voz é determinada pelas cordas normais .,"[False, False, False, False, False, False, False, True, True, False]",A freqüência da voz é determinada pelas coisas vocais .,"[False, False, False, False, False, False, False, True, True, False]",A freqüência da voz é determinada pelas cordas orais .,"[False, False, False, False, False, False, False, True, True, False]",A freqüência da voz é determinada pelos cabos vocais .,"[False, False, False, False, False, False, False, True, True, False]",A freqüência da voz é determinada pelos cabos orais .,"[False, False, False, False, False, False, False, True, True, False]",A freqüência da voz é determinada pelas pregas vocais .,"[False, False, False, False, False, False, False, True, True, False]",A freqüência da voz é determinada pelas ervas anuais .,"[False, False, False, False, False, False, False, True, True, False]",A freqüência da voz é determinada pelas estrelas cadentes .,"[False, False, False, False, False, False, False, True, True, False]",A freqüência da voz é determinada pela mentira terrível .,"[False, False, False, False, False, False, False, True, True, False]",A freqüência da voz é determinada pelas segundas intenções .,"[False, False, False, False, False, False, False, True, True, False]",A freqüência da voz é determinada pelo camareiro imperial .,"[False, False, False, False, False, False, False, True, True, False]",A freqüência da voz é determinada pelas salas cirúrgicas .,"[False, False, False, False, False, False, False, True, True, False]",A freqüência da voz é determinada pelas histórias lindas .,"[False, False, False, False, False, False, False, True, True, False]",A freqüência da voz é determinada pelas primeiras necessidades .,"[False, False, False, False, False, False, False, True, True, False]",A freqüência da voz é determinada pelas passagens alternativas .,"[False, False, False, False, False, False, False, True, True, False]",A freqüência da voz é determinada pelas colunas sociais .,"[False, False, False, False, False, False, False, True, True, False]"
curto-circuito,curto-circuito,[True],Apagaram as luzes com um curto-circuito na casa de força .,"[False, False, False, False, False, True, False, False, False, False, False]",Apagaram as luzes com um curto-circuito na casa de força .,"[True, True, True, True, True, True, True, True, True, True, True]",Apagaram as luzes com um curto na casa de força .,"[False, False, False, False, False, True, False, False, False, False, False]",Apagaram as luzes com um circuito na casa de força .,"[False, False, False, False, False, True, False, False, False, False, False]",Apagaram as luzes com um circiuto normal na casa de força .,"[False, False, False, False, False, True, True, False, False, False, False, False]",Apagaram as luzes com um coiso curto na casa de força .,"[False, False, False, False, False, True, True, False, False, False, False, False]",Apagaram as luzes com um contorno curto na casa de força .,"[False, False, False, False, False, True, True, False, False, False, False, False]",Apagaram as luzes com um circuito limitado na casa de força .,"[False, False, False, False, False, True, True, False, False, False, False, False]",Apagaram as luzes com um contorno limitado na casa de força .,"[False, False, False, False, False, True, True, False, False, False, False, False]",Apagaram as luzes com um problema elétrico na casa de força .,"[False, False, False, False, False, True, True, False, False, False, False, False]",Apagaram as luzes com uma capacidade impressionante na casa de força .,"[False, False, False, False, False, True, True, False, False, False, False, False]",Apagaram as luzes com um céu aberto na casa de força .,"[False, False, False, False, False, True, True, False, False, False, False, False]",Apagaram as luzes com uns fins policiais na casa de força .,"[False, False, False, False, False, True, True, False, False, False, False, False]",Apagaram as luzes com um mau-olhado na casa de força .,"[False, False, False, False, False, True, False, False, False, False, False]",Apagaram as luzes com uma verdadeira simplificação na casa de força .,"[False, False, False, False, False, True, True, False, False, False, False, False]",Apagaram as luzes com um acampamento militar na casa de força .,"[False, False, False, False, False, True, True, False, False, False, False, False]",Apagaram as luzes com um motorista alemão na casa de força .,"[False, False, False, False, False, True, True, False, False, False, False, False]",Apagaram as luzes com um voto secreto na casa de força .,"[False, False, False, False, False, True, True, False, False, False, False, False]",Apagaram as luzes com um âmbito ambiental na casa de força .,"[False, False, False, False, False, True, True, False, False, False, False, False]",Apagaram as luzes com um novo mundo na casa de força .,"[False, False, False, False, False, True, True, False, False, False, False, False]"
