lua nova,luas novas,"[True, True]","Levantem - se pois agora e te salvem os astrólogos , que nas luas novas prognosticam o que há de vir sobre ti .","[False, False, False, False, False, False, False, False, False, False, False, False, False, True, True, False, False, False, False, False, False, False, False, False]","Levantem - se pois agora e te salvem os astrólogos , que nas luas novas prognosticam o que há de vir sobre ti .","[True, True, True, True, True, True, True, True, True, True, True, True, True, True, True, True, True, True, True, True, True, True, True, True]","Levantem - se pois agora e te salvem os astrólogos , que nas luas prognosticam o que há de vir sobre ti .","[False, False, False, False, False, False, False, False, False, False, False, False, False, True, False, False, False, False, False, False, False, False, False]","Levantem - se pois agora e te salvem os astrólogos , que nas novas prognosticam o que há de vir sobre ti .","[False, False, False, False, False, False, False, False, False, False, False, False, False, True, False, False, False, False, False, False, False, False, False]","Levantem - se pois agora e te salvem os astrólogos , que nas luas normais prognosticam o que há de vir sobre ti .","[False, False, False, False, False, False, False, False, False, False, False, False, False, True, True, False, False, False, False, False, False, False, False, False]","Levantem - se pois agora e te salvem os astrólogos , que nas coisas novas prognosticam o que há de vir sobre ti .","[False, False, False, False, False, False, False, False, False, False, False, False, False, True, True, False, False, False, False, False, False, False, False, False]","Levantem - se pois agora e te salvem os astrólogos , que nas luas recentes prognosticam o que há de vir sobre ti .","[False, False, False, False, False, False, False, False, False, False, False, False, False, True, True, False, False, False, False, False, False, False, False, False]","Levantem - se pois agora e te salvem os astrólogos , que nos satélites novos prognosticam o que há de vir sobre ti .","[False, False, False, False, False, False, False, False, False, False, False, False, False, True, True, False, False, False, False, False, False, False, False, False]","Levantem - se pois agora e te salvem os astrólogos , que nos satélites recentes prognosticam o que há de vir sobre ti .","[False, False, False, False, False, False, False, False, False, False, False, False, False, True, True, False, False, False, False, False, False, False, False, False]","Levantem - se pois agora e te salvem os astrólogos , que nas luas prognosticam o que há de vir sobre ti .","[False, False, False, False, False, False, False, False, False, False, False, False, False, True, False, False, False, False, False, False, False, False, False]","Levantem - se pois agora e te salvem os astrólogos , que na vida livre prognosticam o que há de vir sobre ti .","[False, False, False, False, False, False, False, False, False, False, False, False, False, True, True, False, False, False, False, False, False, False, False, False]","Levantem - se pois agora e te salvem os astrólogos , que nas colunas sociais prognosticam o que há de vir sobre ti .","[False, False, False, False, False, False, False, False, False, False, False, False, False, True, True, False, False, False, False, False, False, False, False, False]","Levantem - se pois agora e te salvem os astrólogos , que nas cidades grandes prognosticam o que há de vir sobre ti .","[False, False, False, False, False, False, False, False, False, False, False, False, False, True, True, False, False, False, False, False, False, False, False, False]","Levantem - se pois agora e te salvem os astrólogos , que nas segundas intenções prognosticam o que há de vir sobre ti .","[False, False, False, False, False, False, False, False, False, False, False, False, False, True, True, False, False, False, False, False, False, False, False, False]","Levantem - se pois agora e te salvem os astrólogos , que na única cidade prognosticam o que há de vir sobre ti .","[False, False, False, False, False, False, False, False, False, False, False, False, False, True, True, False, False, False, False, False, False, False, False, False]","Levantem - se pois agora e te salvem os astrólogos , que nas escadas rolantes prognosticam o que há de vir sobre ti .","[False, False, False, False, False, False, False, False, False, False, False, False, False, True, True, False, False, False, False, False, False, False, False, False]","Levantem - se pois agora e te salvem os astrólogos , que nas grandes regiões prognosticam o que há de vir sobre ti .","[False, False, False, False, False, False, False, False, False, False, False, False, False, True, True, False, False, False, False, False, False, False, False, False]","Levantem - se pois agora e te salvem os astrólogos , que nas redes sociais prognosticam o que há de vir sobre ti .","[False, False, False, False, False, False, False, False, False, False, False, False, False, True, True, False, False, False, False, False, False, False, False, False]","Levantem - se pois agora e te salvem os astrólogos , que nas locomotivas diesel prognosticam o que há de vir sobre ti .","[False, False, False, False, False, False, False, False, False, False, False, False, False, True, True, False, False, False, False, False, False, False, False, False]","Levantem - se pois agora e te salvem os astrólogos , que nas luas cheias prognosticam o que há de vir sobre ti .","[False, False, False, False, False, False, False, False, False, False, False, False, False, True, True, False, False, False, False, False, False, False, False, False]"
lugar-comum,lugares-comuns,[True],Cheias de lugares-comuns e banalidades ;,"[False, False, True, False, False, False]",Cheias de lugares-comuns e banalidades ;,"[True, True, True, True, True, True]",Cheias de lugares e banalidades ;,"[False, False, True, False, False, False]",Cheias de comuns e banalidades ;,"[False, False, True, False, False, False]",Cheias de lugares normais e banalidades ;,"[False, False, True, True, False, False, False]",Cheias de coisos comuns e banalidades ;,"[False, False, True, True, False, False, False]",Cheias de lugares públicos e banalidades ;,"[False, False, True, True, False, False, False]",Cheias de locais comuns e banalidades ;,"[False, False, True, True, False, False, False]",Cheias de locais públicos e banalidades ;,"[False, False, True, True, False, False, False]",Cheias de clichês e banalidades ;,"[False, False, True, False, False, False]",Cheias de mandado internacional e banalidades ;,"[False, False, True, True, False, False, False]",Cheias de pontos fortes e banalidades ;,"[False, False, True, True, False, False, False]",Cheias de região mediana e banalidades ;,"[False, False, True, True, False, False, False]",Cheias de navios negreiros e banalidades ;,"[False, False, True, True, False, False, False]",Cheias de segurança global e banalidades ;,"[False, False, True, True, False, False, False]",Cheias de ônibus executivos e banalidades ;,"[False, False, True, True, False, False, False]",Cheias de banda pequena e banalidades ;,"[False, False, True, True, False, False, False]",Cheias de pontos fracos e banalidades ;,"[False, False, True, True, False, False, False]",Cheias de jornal local e banalidades ;,"[False, False, True, True, False, False, False]",Cheias de vôos domésticos e banalidades ;,"[False, False, True, True, False, False, False]"
má-fé,má-fé,[True],Há uma tremenda má-fé no que escreveu o fantasioso Will Durant .,"[False, False, False, True, False, False, False, False, False, False, False, False]",Há uma tremenda má-fé no que escreveu o fantasioso Will Durant .,"[True, True, True, True, True, True, True, True, True, True, True, True]",Há uma tremenda má no que escreveu o fantasioso Will Durant .,"[False, False, False, True, False, False, False, False, False, False, False, False]",Há uma tremenda fé no que escreveu o fantasioso Will Durant .,"[False, False, False, True, False, False, False, False, False, False, False, False]",Há uma tremenda fé normal no que escreveu o fantasioso Will Durant .,"[False, False, False, True, True, False, False, False, False, False, False, False, False]",Há uma tremenda coisa má no que escreveu o fantasioso Will Durant .,"[False, False, False, True, True, False, False, False, False, False, False, False, False]",Há uma tremenda crença má no que escreveu o fantasioso Will Durant .,"[False, False, False, True, True, False, False, False, False, False, False, False, False]",Há uma tremenda fé ruim no que escreveu o fantasioso Will Durant .,"[False, False, False, True, True, False, False, False, False, False, False, False, False]",Há uma tremenda crença ruim no que escreveu o fantasioso Will Durant .,"[False, False, False, True, True, False, False, False, False, False, False, False, False]",Há uma tremenda maldade no que escreveu o fantasioso Will Durant .,"[False, False, False, True, False, False, False, False, False, False, False, False]",Há um tremendo museu federal no que escreveu o fantasioso Will Durant .,"[False, False, False, True, True, False, False, False, False, False, False, False, False]",Há uma tremenda cerca viva no que escreveu o fantasioso Will Durant .,"[False, False, False, True, True, False, False, False, False, False, False, False, False]",Há um tremendo programa construtivo no que escreveu o fantasioso Will Durant .,"[False, False, False, True, True, False, False, False, False, False, False, False, False]",Há uma tremenda magia negra no que escreveu o fantasioso Will Durant .,"[False, False, False, True, True, False, False, False, False, False, False, False, False]",Há uma tremenda pergunta inicial no que escreveu o fantasioso Will Durant .,"[False, False, False, True, True, False, False, False, False, False, False, False, False]",Há uma tremenda roleta russa no que escreveu o fantasioso Will Durant .,"[False, False, False, True, True, False, False, False, False, False, False, False, False]",Há uma tremenda historiografia atual no que escreveu o fantasioso Will Durant .,"[False, False, False, True, True, False, False, False, False, False, False, False, False]",Há uma tremenda maré baixa no que escreveu o fantasioso Will Durant .,"[False, False, False, True, True, False, False, False, False, False, False, False, False]",Há uma tremenda arte difícil no que escreveu o fantasioso Will Durant .,"[False, False, False, True, True, False, False, False, False, False, False, False, False]",Há uma tremenda estrela cadente no que escreveu o fantasioso Will Durant .,"[False, False, False, True, True, False, False, False, False, False, False, False, False]"
magia negra,magia negra,"[True, True]",E envolveu - se com satanismo e magia negra .,"[False, False, False, False, False, False, False, True, True, False]",E envolveu - se com satanismo e magia negra .,"[True, True, True, True, True, True, True, True, True, True]",E envolveu - se com satanismo e magia .,"[False, False, False, False, False, False, False, True, False]",E envolveu - se com satanismo e negra .,"[False, False, False, False, False, False, False, True, False]",E envolveu - se com satanismo e magia normal .,"[False, False, False, False, False, False, False, True, True, False]",E envolveu - se com satanismo e coisa negra .,"[False, False, False, False, False, False, False, True, True, False]",E envolveu - se com satanismo e magia preta .,"[False, False, False, False, False, False, False, True, True, False]",E envolveu - se com satanismo e feitiçaria negra .,"[False, False, False, False, False, False, False, True, True, False]",E envolveu - se com satanismo e feitiçaria preta .,"[False, False, False, False, False, False, False, True, True, False]",E envolveu - se com satanismo e bruxaria .,"[False, False, False, False, False, False, False, True, False]",E envolveu - se com satanismo e pior motivo .,"[False, False, False, False, False, False, False, True, True, False]",E envolveu - se com satanismo e quinta categoria .,"[False, False, False, False, False, False, False, True, True, False]",E envolveu - se com satanismo e união formal .,"[False, False, False, False, False, False, False, True, True, False]",E envolveu - se com satanismo e companhia aérea .,"[False, False, False, False, False, False, False, True, True, False]",E envolveu - se com satanismo e queixa legal .,"[False, False, False, False, False, False, False, True, True, False]",E envolveu - se com satanismo e terceira idade .,"[False, False, False, False, False, False, False, True, True, False]",E envolveu - se com satanismo e tradições específicas .,"[False, False, False, False, False, False, False, True, True, False]",E envolveu - se com satanismo e má-fé .,"[False, False, False, False, False, False, False, True, False]",E envolveu - se com satanismo e históricos conflitos .,"[False, False, False, False, False, False, False, True, True, False]",E envolveu - se com satanismo e estrela cadente .,"[False, False, False, False, False, False, False, True, True, False]"
mão-fechada,mão-fechada,[True],"No jargão popular , um "" rei da sovinice "" , um verdadeiro "" mão-fechada "" .","[False, False, False, False, False, False, False, False, False, False, False, False, False, False, True, False, False]","No jargão popular , um "" rei da sovinice "" , um verdadeiro "" mão-fechada "" .","[True, True, True, True, True, True, True, True, True, True, True, True, True, True, True, True, True]","No jargão popular , um "" rei da sovinice "" , um verdadeiro "" mão "" .","[False, False, False, False, False, False, False, False, False, False, False, False, False, False, True, False, False]","No jargão popular , um "" rei da sovinice "" , um verdadeiro "" fechado "" .","[False, False, False, False, False, False, False, False, False, False, False, False, False, False, True, False, False]","No jargão popular , um "" rei da sovinice "" , um verdadeiro "" mão normal "" .","[False, False, False, False, False, False, False, False, False, False, False, False, False, False, True, True, False, False]","No jargão popular , um "" rei da sovinice "" , um verdadeiro "" coisa fechada "" .","[False, False, False, False, False, False, False, False, False, False, False, False, False, False, True, True, False, False]","No jargão popular , um "" rei da sovinice "" , um verdadeiro "" mão cerrada "" .","[False, False, False, False, False, False, False, False, False, False, False, False, False, False, True, True, False, False]","No jargão popular , um "" rei da sovinice "" , um verdadeiro "" palmo fechado "" .","[False, False, False, False, False, False, False, False, False, False, False, False, False, False, True, True, False, False]","No jargão popular , um "" rei da sovinice "" , um verdadeiro "" palmo cerrado "" .","[False, False, False, False, False, False, False, False, False, False, False, False, False, False, True, True, False, False]","No jargão popular , um "" rei da sovinice "" , um verdadeiro "" pão duro "" .","[False, False, False, False, False, False, False, False, False, False, False, False, False, False, True, True, False, False]","No jargão popular , um "" rei da sovinice "" , um verdadeiro "" herói positivo "" .","[False, False, False, False, False, False, False, False, False, False, False, False, False, False, True, True, False, False]","No jargão popular , um "" rei da sovinice "" , um verdadeiro "" livro aberto "" .","[False, False, False, False, False, False, False, False, False, False, False, False, False, False, True, True, False, False]","No jargão popular , um "" rei da sovinice "" , uma verdadeira "" textura sonora "" .","[False, False, False, False, False, False, False, False, False, False, False, False, False, False, True, True, False, False]","No jargão popular , um "" rei da sovinice "" , um verdadeiro "" ar condicionado "" .","[False, False, False, False, False, False, False, False, False, False, False, False, False, False, True, True, False, False]","No jargão popular , um "" rei da sovinice "" , um verdadeiro "" uniforme negro "" .","[False, False, False, False, False, False, False, False, False, False, False, False, False, False, True, True, False, False]","No jargão popular , um "" rei da sovinice "" , um verdadeiro "" ano-novo "" .","[False, False, False, False, False, False, False, False, False, False, False, False, False, False, True, False, False]","No jargão popular , um "" rei da sovinice "" , um verdadeiro "" espírito santo "" .","[False, False, False, False, False, False, False, False, False, False, False, False, False, False, True, True, False, False]","No jargão popular , um "" rei da sovinice "" , um verdadeiro "" curto-circuito "" .","[False, False, False, False, False, False, False, False, False, False, False, False, False, False, True, False, False]","No jargão popular , um "" rei da sovinice "" , um verdadeiro "" conteúdo genérico "" .","[False, False, False, False, False, False, False, False, False, False, False, False, False, False, True, True, False, False]","No jargão popular , um "" rei da sovinice "" , um verdadeiro "" longa-metragem "" .","[False, False, False, False, False, False, False, False, False, False, False, False, False, False, True, False, False]"
máquina virtual,máquina virtual,"[True, True]","Feito isso , sua nova máquina virtual estará pronta para receber o Windows 8 .","[False, False, False, False, False, True, True, False, False, False, False, False, False, False, False]","Feito isso , sua nova máquina virtual estará pronta para receber o Windows 8 .","[True, True, True, True, True, True, True, True, True, True, True, True, True, True, True]","Feito isso , sua nova máquina estará pronta para receber o Windows 8 .","[False, False, False, False, False, True, False, False, False, False, False, False, False, False]","Feito isso , sua nova virtual estará pronta para receber o Windows 8 .","[False, False, False, False, False, True, False, False, False, False, False, False, False, False]","Feito isso , sua nova máquina normal estará pronta para receber o Windows 8 .","[False, False, False, False, False, True, True, False, False, False, False, False, False, False, False]","Feito isso , sua nova coisa virtual estará pronta para receber o Windows 8 .","[False, False, False, False, False, True, True, False, False, False, False, False, False, False, False]","Feito isso , sua nova máquina potencial estará pronta para receber o Windows 8 .","[False, False, False, False, False, True, True, False, False, False, False, False, False, False, False]","Feito isso , seu novo aparelho virtual estará pronto para receber o Windows 8 .","[False, False, False, False, False, True, True, False, False, False, False, False, False, False, False]","Feito isso , seu novo aparelho potencial estará pronto para receber o Windows 8 .","[False, False, False, False, False, True, True, False, False, False, False, False, False, False, False]","Feito isso , seu novo computador virtual estará pronta para receber o Windows 8 .","[False, False, False, False, False, True, True, False, False, False, False, False, False, False, False]","Feito isso , seu novo escritor vencedor estará pronta para receber o Windows 8 .","[False, False, False, False, False, True, True, False, False, False, False, False, False, False, False]","Feito isso , sua nova corda bamba estará pronta para receber o Windows 8 .","[False, False, False, False, False, True, True, False, False, False, False, False, False, False, False]","Feito isso , sua nova electrónica moderna estará pronta para receber o Windows 8 .","[False, False, False, False, False, True, True, False, False, False, False, False, False, False, False]","Feito isso , sua nova água doce estará pronta para receber o Windows 8 .","[False, False, False, False, False, True, True, False, False, False, False, False, False, False, False]","Feito isso , sua nova estratégia genérica estará pronta para receber o Windows 8 .","[False, False, False, False, False, True, True, False, False, False, False, False, False, False, False]","Feito isso , sua nova queda livre estará pronta para receber o Windows 8 .","[False, False, False, False, False, True, True, False, False, False, False, False, False, False, False]","Feito isso , sua nova dívida multilateral estará pronta para receber o Windows 8 .","[False, False, False, False, False, True, True, False, False, False, False, False, False, False, False]","Feito isso , sua nova vaca louca estará pronta para receber o Windows 8 .","[False, False, False, False, False, True, True, False, False, False, False, False, False, False, False]","Feito isso , suas novas entidades feministas estarão prontas para receber o Windows 8 .","[False, False, False, False, False, True, True, False, False, False, False, False, False, False, False]","Feito isso , sua nova classe executiva estará pronta para receber o Windows 8 .","[False, False, False, False, False, True, True, False, False, False, False, False, False, False, False]"
mar aberto,mar aberto,"[True, True]","Alcançada a ponta de Santo Antonio , saíram a mar aberto .","[False, False, False, False, False, False, False, False, False, True, True, False]","Alcançada a ponta de Santo Antonio , saíram a mar aberto .","[True, True, True, True, True, True, True, True, True, True, True, True]","Alcançada a ponta de Santo Antonio , saíram a mar .","[False, False, False, False, False, False, False, False, False, True, False]","Alcançada a ponta de Santo Antonio , saíram a aberto .","[False, False, False, False, False, False, False, False, False, True, False]","Alcançada a ponta de Santo Antonio , saíram a mar normal .","[False, False, False, False, False, False, False, False, False, True, True, False]","Alcançada a ponta de Santo Antonio , saíram a coiso aberto .","[False, False, False, False, False, False, False, False, False, True, True, False]","Alcançada a ponta de Santo Antonio , saíram a mar acessível .","[False, False, False, False, False, False, False, False, False, True, True, False]","Alcançada a ponta de Santo Antonio , saíram a oceano aberto .","[False, False, False, False, False, False, False, False, False, True, True, False]","Alcançada a ponta de Santo Antonio , saíram a oceano acessível .","[False, False, False, False, False, False, False, False, False, True, True, False]","Alcançada a ponta de Santo Antonio , saíram a alto mar .","[False, False, False, False, False, False, False, False, False, True, True, False]","Alcançada a ponta de Santo Antonio , saíram a tremenda quantidade .","[False, False, False, False, False, False, False, False, False, True, True, False]","Alcançada a ponta de Santo Antonio , saíram a relógio biológico .","[False, False, False, False, False, False, False, False, False, True, True, False]","Alcançada a ponta de Santo Antonio , saíram a domínio chinês .","[False, False, False, False, False, False, False, False, False, True, True, False]","Alcançada a ponta de Santo Antonio , saíram a caixeiro viajante .","[False, False, False, False, False, False, False, False, False, True, True, False]","Alcançada a ponta de Santo Antonio , saíram a médico norueguês .","[False, False, False, False, False, False, False, False, False, True, True, False]","Alcançada a ponta de Santo Antonio , saíram a céu aberto .","[False, False, False, False, False, False, False, False, False, True, True, False]","Alcançada a ponta de Santo Antonio , saíram a discos antigos .","[False, False, False, False, False, False, False, False, False, True, True, False]","Alcançada a ponta de Santo Antonio , saíram a Processo seletivo .","[False, False, False, False, False, False, False, False, False, True, True, False]","Alcançada a ponta de Santo Antonio , saíram a mercados exteriores .","[False, False, False, False, False, False, False, False, False, True, True, False]","Alcançada a ponta de Santo Antonio , saíram a relógio analógico .","[False, False, False, False, False, False, False, False, False, True, True, False]"
